nct_id,start_date.x,primary_completion_date.x,study_type.x,brief_title.x,overall_status.x,phase.x,source.x,why_stopped.x,pubmed_links,ctg_links,Abstract,Registry,Total_pubs,country,Has_Results,Number_of_updates,intervention,vaccine_trial_flag
NCT04858789,6/24/2021,12/31/2021,Interventional,The Effectiveness of a CA-CBI on Psychological Distress of University Students During the COVID-19 Pandemic,Recruiting,Not Applicable,Koç University,NA,NA,NA,NA,NA,NA,Turkey,0,5,Culturally Adapted Cognitive Behavioral Intervention (CA-CBI),0
NCT04858412,4/1/2021,3/31/2022,Interventional,Study of HMB-enriched Amino Acid Supplementation in Patients With Alcoholic Liver Disease and COVID-19,Recruiting,Not Applicable,The Cleveland Clinic,NA,NA,NA,NA,NA,NA,United States,0,0,β-hydroxy β-methyl butyrate (HMB) enriched amino acid|Balanced amino acid,0
NCT04857060,7/1/2021,1/31/2023,Interventional,Palliative Care Educator,Recruiting,Not Applicable,Boston Medical Center,NA,NA,NA,NA,NA,NA,United States,0,3,"ACP Educator led, video assisted discussion",0
NCT04856111,3/17/2021,12/31/2021,Interventional,Pirfenidone vs. Nintedanib for Fibrotic Lung Disease After Coronavirus Disease-19 Pneumonia,Recruiting,Phase 4,Postgraduate Institute of Medical Education and Research,NA,NA,NA,NA,NA,NA,India,0,1,Pirfenidone|Nintedanib,0
NCT04858542,2/26/2021,5/31/2021,Interventional,Evaluating the Impact of Vocal Health Education on Mask-wearing Workers During COVID-19,Recruiting,Not Applicable,University of Cincinnati,NA,NA,NA,NA,NA,NA,United States,0,0,Educational Vocal Health Modules,0
NCT04854941,12/10/2020,3/10/2021,Interventional,Efficacy of Probiotics in the Treatment of Hospitalised Patients With Novel Coronavirus Infection,Completed,Not Applicable,I.M. Sechenov First Moscow State Medical University,NA,NA,NA,NA,NA,NA,Russian Federation,0,0,Probiotics,0
NCT04854928,5/3/2021,2/28/2022,Interventional,Study to Evaluate a Single Dose of LTX-109 in Subjects With COVID-19 (Coronavirus Disease 2019) Infection.,Recruiting,Phase 2,Pharma Holdings AS,NA,NA,NA,NA,NA,NA,Sweden,0,3,"LTX-109 gel, 3%|Placebo gel",0
NCT04854772,5/15/2021,5/31/2022,Interventional,Mind Body Intervention for COVID-19 Long Haul Syndrome,Recruiting,Not Applicable,Beth Israel Deaconess Medical Center,NA,NA,NA,NA,NA,NA,United States,0,1,Mind Body Syndrome Therapy for Long Covid,0
NCT04854382,4/14/2021,11/30/2021,Interventional,Tailored Information About the Coronavirus in Chronic Kidney Disease Patients,Recruiting,Not Applicable,"University Hospital, Akershus",NA,NA,NA,NA,NA,NA,Norway,0,1,Tailored information,0
NCT04854798,4/29/2021,8/31/2021,Interventional,UNITE Study (UMN-SW) for COVID-19,Enrolling by invitation,Not Applicable,University of Minnesota,NA,NA,NA,NA,NA,NA,United States,0,3,Splenic Ultrasound,0
NCT04854759,3/15/2021,3/31/2022,Interventional,The Use of Amantadine in the Prevention of Progression and Treatment of COVID-19 Symptoms,Recruiting,Phase 3,Independent Public Clinical Hospital No. 4 in Lublin,NA,NA,NA,NA,NA,NA,Poland,0,2,Amantadine Hydrochloride|Placebo,0
NCT04853979,5/16/2021,8/30/2021,Interventional,Awake Prone Positioning in COVID-19 Suspects With Hypoxemic Respiratory Failure,Recruiting,Not Applicable,Hamad Medical Corporation,NA,NA,NA,NA,NA,NA,Qatar,0,1,PRONE POSITION,0
NCT04853927,2/8/2021,10/30/2021,Interventional,Proxalutamide Treatment for COVID-19 Patients in Intensive Care Unit,Recruiting,Phase 3,"Applied Biology, Inc.",NA,NA,NA,NA,NA,NA,Brazil,0,1,Proxalutamide|Placebo,0
NCT04853966,4/17/2021,4/17/2022,Interventional,The Effects of Physical Activity Counseling on Physical Activity and Quality of Life in Covid-19 Patients,Recruiting,Not Applicable,Gazi University,NA,NA,NA,NA,NA,NA,Turkey,0,0,Physical activity counseling,0
NCT04853199,6/1/2021,7/30/2021,Interventional,Quercetin In The Treatment Of SARS-COV 2,Recruiting,Early Phase 1,Hôpital Universitaire Sahloul,NA,NA,NA,NA,NA,NA,Tunisia,0,3,Quercetin|Placebo,0
NCT04853134,11/1/2020,12/1/2021,Interventional,Proxalutamide Treatment for COVID-19 Female Outpatients,"Active, not recruiting",Phase 3,"Applied Biology, Inc.",NA,NA,NA,NA,NA,NA,Brazil,0,1,Proxalutamide|Standard of Care,0
NCT04853901,7/27/2020,1/1/2021,Interventional,Remdesivir Efficacy In Management Of COVID-19 Patients,Completed,Phase 3,Ain Shams University,NA,NA,NA,NA,NA,NA,Egypt,0,0,Remdesivir|Standard of care_1|Standard of care_2,0
NCT04851821,1/4/2021,5/30/2021,Interventional,The Effectiveness of Phytotherapy in SARS-COV2(COVID-19),Completed,Phase 1,Hôpital Universitaire Sahloul,NA,NA,NA,NA,NA,NA,Tunisia,0,3,Quercetin,0
NCT04849793,4/13/2021,5/13/2021,Interventional,The Effect of Acupressure on the Anxiety Level,Enrolling by invitation,Not Applicable,Mersin University,NA,NA,NA,NA,NA,NA,Turkey,0,1,Acupressure,0
NCT04849637,10/22/2020,6/30/2021,Interventional,Virgin Coconut Oil as Adjunctive Therapy for Hospitalized COVID-19 Patients,Recruiting,Phase 2,University of the Philippines,NA,NA,NA,NA,NA,NA,Philippines,0,0,Virgin Coconut Oil,0
NCT04847583,7/29/2021,12/31/2021,Interventional,"A Phase 2 Study to Evaluate Biomarker Change, Efficacy, Pharmacokinetics, Safety and Tolerability of Telacebec (Q203) in Covid-19 Patients",Recruiting,Phase 2,"Qurient Co., Ltd.",NA,NA,NA,NA,NA,NA,South Africa,0,2,Telacebec|COVID-19 Standard of care,0
NCT04847661,3/28/2021,7/30/2021,Interventional,"Efficacy of Mefloquine as Prophylaxis Against COVID-19: A Placebo-control, Randomized Clinical Trial",Recruiting,Phase 2/Phase 3,Helwan University,NA,NA,NA,NA,NA,NA,Egypt,0,0,Mefloquine as a prophylaxis against SARS-Cov-2 infection in household contacts of COVID 19 confirmed cases,0
NCT04847791,1/14/2021,1/31/2022,Interventional,Lactoferrin in Covid-19 Hospitalized Patients,Recruiting,Not Applicable,Paolo Manzoni,NA,NA,NA,NA,NA,NA,Italy,0,0,Bovine lactoferrin|Placebo administration,0
NCT04847349,4/13/2021,10/13/2021,Interventional,Live Microbials to Boost Anti-Severe Acute Respiratory Syndrome Coronavirus-2 (SARS-CoV-2) Immunity Clinical Trial,Recruiting,Not Applicable,"Rutgers, The State University of New Jersey",NA,NA,NA,NA,NA,NA,United States,0,1,"OL-1, standard dose|OL-1, high dose|Placebo",0
NCT04847544,3/31/2021,12/31/2021,Interventional,"A Randomized, Double-Blind, Placebo-Controlled, Clinical Trial to Evaluate the Safety, Tolerability, Efficacy, and Pharmacodynamics for the Treatment of COVID-19.",Recruiting,Phase 2,"Aldeyra Therapeutics, Inc.",NA,NA,NA,NA,NA,NA,United States,0,0,ADX-629|Placebo,0
NCT04847518,5/26/2021,1/31/2022,Interventional,Assessment of Efficacy of KAN-JANG® in Mild COVID-19,Recruiting,Phase 2/Phase 3,Swedish Herbal Institute AB,NA,NA,NA,NA,NA,NA,Georgia,0,1,Kan Jang capsules|Placebo capsules,0
NCT04847479,5/6/2021,5/10/2022,Interventional,COVID-19 Close Contact Self-Testing Study,Recruiting,Not Applicable,University of Pennsylvania,NA,NA,NA,NA,NA,NA,United States,0,3,COVID-19 self-test|COVID-19 test referral,0
NCT04845880,10/1/2020,3/1/2021,Interventional,SARS Cov_2 Incidence of Healthy Health Workers,Completed,Not Applicable,Baskent University,NA,NA,NA,NA,NA,NA,Turkey,0,0,Spike protein (S) or the nucleocapsid (N) of SARS-CoV-2,0
NCT04846790,7/16/2021,12/1/2022,Interventional,The Effect of a Combined Nature-based and Virtual Mindfulness Intervention on Perceived Stress in Healthcare Workers,Enrolling by invitation,Not Applicable,National Institutes of Health Clinical Center (CC),NA,NA,NA,NA,NA,NA,United States,0,2,Nature Only|Nature+Mindfulness,0
NCT04846010,3/1/2021,5/1/2022,Interventional,"Recovering Damaged Cells for Sequelae Caused by COVID-19, SARS-CoV-2",Recruiting,Phase 1/Phase 2,"All Natural Medicine Clinic, LLC",NA,NA,NA,NA,NA,NA,United States,0,2,PurWet|FurFat|PurApo|PurPhl|PurClo|PurInf|Smoliv,0
NCT04845971,11/5/2020,4/30/2021,Interventional,Efficacy and Safety of Oral Immunotherapy With GcMAF in Hospitalized Patients With COVID-19 Pneumonia,Completed,Phase 2,Ospedale del Mare,NA,NA,NA,NA,NA,NA,Italy,0,2,Saisei Maf capsules,0
NCT04844580,3/10/2021,9/30/2022,Interventional,A Clinical Study Evaluating Inhaled Aviptadil on COVID-19,Recruiting,Phase 2,Centurion Pharma,NA,NA,NA,NA,NA,NA,Turkey,0,2,Inhaled Aviptadil|Placebo,0
NCT04844554,6/20/2021,4/12/2022,Interventional,Protocol of Assistance to Patients With Covid-19 Submitted to Treatment With HD-tDCS,Recruiting,Not Applicable,Federal University of Paraíba,NA,NA,NA,NA,NA,NA,Brazil,0,1,HD-tDCS 4mA|HD-tDCS 2mA,0
NCT04844710,9/1/2020,11/15/2020,Interventional,The Effects of Acupuncture in Overcoming Inflammatory Response to COVID-19 Mild-moderate Symptoms,Completed,Not Applicable,Indonesia University,NA,NA,NA,NA,NA,NA,Indonesia,0,0,acupuncture and standard care|standard care,0
NCT04844567,11/26/2020,12/31/2021,Interventional,Virtual Reality Intervention to Alleviate Breathlessness (COVID-19),Recruiting,Not Applicable,Ecole Polytechnique Fédérale de Lausanne,NA,NA,NA,NA,NA,NA,Switzerland,0,0,COVVR,0
NCT04844489,4/16/2021,4/16/2023,Interventional,Study of the Humoral Response to SARS-CoV-2 Variants and of the Cellular Response After Vaccination Against COVID-19 in Immunocompromised People,Recruiting,Not Applicable,Assistance Publique - Hôpitaux de Paris,NA,NA,NA,NA,NA,NA,France,0,2,Blood samples for the study of the humoral response to SARS-CoV-2 variants and of the cellular response after vaccination against COVID-19,1
NCT04843930,6/17/2021,7/31/2022,Interventional,Improving Cognitive Health in COVID-19 Survivors,Recruiting,Phase 2,Weill Medical College of Cornell University,NA,NA,NA,NA,NA,NA,United States,0,1,AKL-T01,0
NCT04844346,4/19/2021,8/31/2021,Interventional,Plant Stanol Esters and COVID-19 Vaccination Response,Recruiting,Not Applicable,Maastricht University Medical Center,NA,NA,NA,NA,NA,NA,Netherlands,0,NA,Plant stanol mini drinks|Placebo mini drinks|COVID-19 vaccine,1
NCT04842708,12/24/2020,10/24/2021,Interventional,Evaluation of Anti-COVID 19 Pfizer Vaccination Effect on COVID 19 Detection Using Breath Analysis,Recruiting,Not Applicable,Scentech Medical Technologies Ltd,NA,NA,NA,NA,NA,NA,Israel,0,0,vaccination against COVID19,1
NCT04842292,5/20/2021,2/28/2022,Interventional,Nebulized Heparin for COVID19-associated Acute Respiratory Failure,Recruiting,Phase 2,University of Kentucky,NA,NA,NA,NA,NA,NA,United States,0,1,Heparin|Placebo,0
NCT04842448,9/15/2021,12/31/2022,Interventional,Safety and Efficacy of Hyperbaric Oxygen Therapy for Long COVID Syndrome,Recruiting,Phase 2,Karolinska University Hospital,NA,NA,NA,NA,NA,NA,Sweden,0,3,Hyperbaric oxygen|Sham treatment,0
NCT04842435,4/12/2021,9/30/2021,Interventional,Clinical Study in the Treatment of Patients With Moderate Course of COVID-19,Recruiting,Phase 2/Phase 3,Microgen,NA,NA,NA,NA,NA,NA,Russian Federation,0,2,COVID-globulin|Placebo,0
NCT04840992,4/20/2021,4/15/2022,Interventional,Phase I/II Clinical Trial of Recombinant Novel Coronavirus (COVID-19) Vaccine (Adenovirus Type 5 Vector) for Inhalation,Recruiting,Phase 1/Phase 2,CanSino Biologics Inc.,NA,NA,NA,NA,NA,NA,China,0,1,Recombinant Novel Coronavirus Vaccine (Adenovirus Type 5 Vector) for Inhalation|Recombinant Novel Coronavirus Vaccine (Adenovirus Type 5 Vector)|Placebo for Inhalation|Placebo,1
NCT04842331,4/30/2021,1/31/2022,Interventional,PREvent Viral Exposure aNd Transmission Study: a SARS-CoV-2 PEP Study (PREVENT),Recruiting,Phase 2/Phase 3,Thirty Respiratory Limited,NA,NA,NA,NA,NA,NA,United Kingdom,0,0,"RESP301, a Nitric Oxide generating solution",0
NCT04841746,6/2/2021,9/2/2022,Interventional,Efficacy of FES Cycling After a Severe Form of COVID-19,Recruiting,Not Applicable,Hospices Civils de Lyon,NA,NA,NA,NA,NA,NA,France,0,2,Physical therapy that include a standardized cycling training with functional electrical stimulation|Physical therapy that include a standardized cycling training with no additional functional electrical stimulation,0
NCT04840459,11/20/2020,12/31/2021,Interventional,Use of Monoclonal Antibodies for the Treatment of Mild to Moderate COVID-19 in Non-Hospitalized Setting,Recruiting,Phase 2,DHR Health Institute for Research and Development,NA,NA,NA,NA,NA,NA,United States,0,0,BAMLANIVIMAB|CASIRIVIMAB|IMDEVIMAB,0
NCT04839965,5/31/2021,10/31/2021,Interventional,Study of Intravenous Ampion in Adult COVID-19 Patients Requiring Supplemental Oxygen,Recruiting,Phase 2,Ampio Pharmaceuticals. Inc.,NA,NA,NA,NA,NA,NA,United States,0,3,Ampion|Saline,0
NCT04839315,2/15/2021,12/31/2021,Interventional,COVID-19 Vaccination in Rheumatic Disease Patients,Recruiting,Early Phase 1,Mayo Clinic,NA,NA,NA,NA,NA,NA,United States,0,0,mRNA COVD19 vaccine,1
NCT04838821,3/29/2021,7/29/2021,Interventional,Efficacy and Safety of Three Different Doses of an Anti SARS-CoV-2 Hyperimmune Equine Serum in COVID-19 Patients,Recruiting,Phase 2/Phase 3,Caja Costarricense de Seguro Social,NA,NA,NA,NA,NA,NA,Costa Rica,0,1,Anti SARS-CoV-2 equine hyperimmune serum|placebo,0
NCT04838080,3/19/2021,6/1/2021,Interventional,Safety and Immunogenicity of the Inactivated Koçak-19 Inaktif Adjuvanlı COVID-19 Vaccine Compared to Placebo,Recruiting,Phase 1,Kocak Farma,NA,NA,NA,NA,NA,NA,Turkey,0,1,Koçak-19 Inaktif Adjuvanlı COVID-19 Vaccine 4 µg/0.5 ml Vaccine|Koçak-19 Inaktif Adjuvanlı COVID-19 Vaccine 6 µg/0.5 ml Vaccine|Placebo,1
NCT04836260,4/8/2021,12/31/2021,Interventional,Preemptive Use of Convalescent Plasma for High-risk Patients With COVID-19,Recruiting,Phase 3,"University Hospital, Geneva",NA,NA,NA,NA,NA,NA,Switzerland,0,0,SARS-CoV-2 convalescent plasma,0
NCT04834908,6/30/2021,3/31/2022,Interventional,Evaluation of Equine Antibody Treatment in Patients With COVID 19 Infection,Recruiting,Phase 1/Phase 2,Bharat Serums and Vaccines Limited,NA,NA,NA,NA,NA,NA,India,0,2,Equine COVID-19 Antiserum|Standard of care,0
NCT04836052,12/24/2020,8/24/2021,Interventional,Omega-3 Oil Use in COVID-19 Patients in Qatar,Recruiting,Phase 3,Hamad Medical Corporation,NA,NA,NA,NA,NA,NA,Qatar,0,0,Omega 3 fatty acid,0
NCT04836351,3/1/2021,12/30/2023,Interventional,Rehabilitation for Patients With Persistent Symptoms Post COVID-19,Recruiting,Not Applicable,Western Norway University of Applied Sciences,NA,NA,NA,NA,NA,NA,Norway,0,0,Concentrated rehabilitation for patients with persistent symptoms post COVID-19,0
NCT04834856,4/1/2021,8/20/2021,Interventional,"Viral Clearance, PK and Tolerability of Ensovibep in COVID-19 Patients",Completed,Phase 2,Molecular Partners AG,NA,NA,NA,NA,NA,NA,Netherlands,0,2,ensovibep,0
NCT04834739,1/4/2021,3/28/2021,Interventional,Comparison of Functional Capacities of Healthcare Workers With and Without Covid-19,Completed,Not Applicable,Gaziosmanpasa Research and Education Hospital,NA,NA,NA,NA,NA,NA,Turkey,0,1,6 minute walk test|1 minute Sit to Stand Test|Fatigue Severity Scale|Medical Research Council (MRC) dyspnea scale|SF-12|Beck Depression Inventory|Beck Anxiety Inventory|5 times sit to stand test|6 point Likert Scale,0
NCT04834726,4/29/2021,6/4/2021,Interventional,COVID-19 Vaccine Text Outreach,Completed,Not Applicable,University of Pennsylvania,NA,NA,NA,NA,NA,NA,United States,0,4,Opt-In (Call-Back)|Opt-in (In-Bound)|Standard Message|Clinician Endorsement|Scarcity|Opt-Out Framing|Phone Call,1
NCT04834115,11/17/2020,4/30/2021,Interventional,Efficacy of Ivermectin in Outpatients With Non-severe COVID-19,Recruiting,Phase 3,Universidad Nacional de Asunción,NA,NA,NA,NA,NA,NA,Paraguay,0,0,Ivermectin Tablets|Placebo,0
NCT04833101,4/7/2021,6/15/2021,Interventional,Study on Heterologous Prime-boost of Recombinant COVID-19 Vaccine (Ad5 Vector) and RBD-based Protein Subunit Vaccine,"Active, not recruiting",Phase 4,Jiangsu Province Centers for Disease Control and Prevention,NA,NA,NA,NA,NA,NA,China,0,5,recombinant Ad5 vectored COVID-19 vaccine|RBD-based protein subunit vaccine (ZF2001) against COVID-19|trivalent split influenza vaccine,1
NCT04832919,7/23/2021,5/31/2022,Interventional,A Nurse-Community Health Worker-Family Partnership Model: Addressing Uptake of COVID-19 Testing and Control Measures,Recruiting,Not Applicable,New York University,NA,NA,NA,NA,NA,NA,United States,0,3,Nurse-Community-Family Partnership Intervention,0
NCT04830800,3/10/2021,5/30/2022,Interventional,A Phase 1/2 Safety and Immunogenicity Trial of COVID-19 Vaccine COVIVAC,Recruiting,Phase 1/Phase 2,"Institute of Vaccines and Medical Biologicals, Vietnam",NA,NA,NA,NA,NA,NA,Vietnam,0,0,COVIVAC|Phosphate-buffered saline,1
NCT04830020,2/26/2021,8/31/2021,Interventional,Use of Inhaled High-molecular Weight Hyaluronan in Patients With Severe COVID19: Feasibility and Outcomes,Recruiting,Phase 2,Campus Bio-Medico University,NA,NA,NA,NA,NA,NA,Italy,0,0,HMW-HA,0
NCT04828135,5/26/2021,12/30/2022,Interventional,Dual MRI for Cardiopulmonary COVID-19 Long Haulers,Recruiting,Phase 2,Duke University,NA,NA,NA,NA,NA,NA,United States,0,3,Hyperpolarized 129Xenon gas,0
NCT04826822,2/24/2021,7/8/2021,Interventional,Spironolactone and Dexamethasone in Patients Hospitalized With COVID-19,Recruiting,Phase 3,Chita State Regional Clinical Hospital Number 1,NA,NA,NA,NA,NA,NA,Russian Federation,0,0,Spironolactone + Dexamethasone|Standard-of-care SARS-CoV-2 treatment,0
NCT04826367,1/20/2021,12/31/2021,Interventional,Relaxation Training by Tele-Rehabilitation in Patients With Breast Cancer,Recruiting,Not Applicable,Hacettepe University,NA,NA,NA,NA,NA,NA,Turkey,0,1,Telerehabilitation-based relaxation exercise group (EG),0
NCT04824638,3/8/2021,6/29/2021,Interventional,BNT162b2 Vaccination With Two Doses in COVID-19 Negative Adult Volunteers and With a Single Dose in COVID-19 Positive Adult Volunteers,"Active, not recruiting",Phase 2,"ANRS, Emerging Infectious Diseases",NA,NA,NA,NA,NA,NA,France,0,1,two doses of BNT162b2 vaccine|one dose of BNT162b2 vaccine,1
NCT04824443,3/29/2021,3/29/2023,Interventional,Exercise Therapy in Cancer Patients Who Are Recovering From COVID-19,Recruiting,Phase 1,Memorial Sloan Kettering Cancer Center,NA,NA,NA,NA,NA,NA,United States,0,2,Aerobic Exercise Therapy,0
NCT04824365,4/12/2021,5/31/2022,Interventional,Sodium Pyruvate Nasal Spray Treatment of COVID-19 and Influenza Infections,Recruiting,Phase 2/Phase 3,"Cellular Sciences, inc.",NA,NA,NA,NA,NA,NA,United States,0,3,Sodium Pyruvate|Saline,0
NCT04824391,2/10/2021,4/30/2021,Interventional,"Efficacy, Immunogenicity and Safety of Inactivated ERUCOV-VAC Compared With Placebo in COVID-19",Recruiting,Phase 2,Health Institutes of Turkey,NA,NA,NA,NA,NA,NA,Turkey,0,0,ERUCOV-VAC 3 µg/0.5 ml Vaccine|ERUCOV-VAC 6 µg/0.5 ml Vaccine|Placebo,1
NCT04822285,1/22/2020,4/22/2020,Interventional,Effect Psychological Triaging Intervention on Students' Psychological Distress and Resilience Capacity,Completed,Not Applicable,Alexandria University,NA,NA,NA,NA,NA,NA,Egypt,0,0,Psychological Triaging Intervention|Routine psychological support,0
NCT04821037,6/1/2021,7/1/2021,Interventional,Nurse Health Pilot: Feasibility and Acceptability of a Virtual ACT-intervention in Nurses During COVID-19,Recruiting,Not Applicable,University of Basel,NA,NA,NA,NA,NA,NA,Switzerland,0,1,ACT,0
NCT04821973,9/22/2020,5/15/2021,Interventional,Respiratory Tele Monitoring COVID 19 (TMR COVID-19),Recruiting,Not Applicable,Assistance Publique Hopitaux De Marseille,NA,NA,NA,NA,NA,NA,France,0,0,Radius PPG Tetherless Pulse Oximetry (Masimo)|usual monitoring,0
NCT04820803,2/3/2021,4/29/2021,Interventional,Assessment of the Impact of Oral Intervention With Cetylpyridinium Chloride to Decrease SARS-CoV-2 Viral Load in Patients With COVID-19,Completed,Not Applicable,Instituto de Investigación Sanitaria Aragón,NA,NA,NA,NA,NA,NA,Spain,0,1,ORAL INTERVENTION WITH CETYLPYRIDINIUM CHLORIDE|PLACEBO,0
NCT04818970,5/21/2021,12/31/2021,Interventional,Photo-Protection Trial (NB-UVB vs. Placebo) in High-risk Hospitalized COVID-19 Patients,Recruiting,Not Applicable,"Cytokind, Inc.",NA,NA,NA,NA,NA,NA,United States,0,3,Narrow Band ultraviolet B-Band Light|non Narrow Band ultraviolet B-Band Light,0
NCT04818216,6/11/2021,6/30/2022,Interventional,Nicotinamide Riboside in SARS-CoV-2 (COVID-19) Patients for Renal Protection,Recruiting,Phase 2,The University of Texas Health Science Center at San Antonio,NA,NA,NA,NA,NA,NA,United States,0,4,Placebo|Nicotinamide riboside,0
NCT04818281,3/27/2021,1/31/2022,Interventional,Study of a Severe Acute Respiratory Syndrome CoV-2 (SARS-CoV-2) Virus-like Particle (VLP) Vaccine in Healthy Adults,Recruiting,Phase 1,The Scientific and Technological Research Council of Turkey,NA,NA,NA,NA,NA,NA,Turkey,0,3,SARS-CoV-2 VLP Vaccine|Placebo,1
NCT04817371,3/1/2021,3/31/2022,Interventional,Analysis of Volatile Organic Compounds in Exhaled Air and Sweat: Interest in Rapid Screening for COVID-19 Infection.,Recruiting,Not Applicable,Hopital Foch,NA,NA,NA,NA,NA,NA,France,0,1,Canine odor detection of Volatile Organic Compounds|Volatile Organic Compounds analysis (mass spectrometry)|Volatile Organic Compounds analysis in sweat (mass spectrometry)|Volatile Organic Compounds analysis (e-noses),0
NCT04817332,6/5/2020,2/28/2021,Interventional,STOP-COVID19: Superiority Trial Of Protease Inhibition in COVID-19,Completed,Phase 3,University of Dundee,NA,NA,NA,NA,NA,NA,United Kingdom,0,1,Brensocatib|Placebo,0
NCT04816942,4/23/2020,7/21/2020,Interventional,Clinical Efficacy of Early Administration of Convalescent Plasma Among COVID-19 Cases in Egypt,Completed,Phase 3,"Ministry of Health and Population, Egypt",NA,NA,NA,NA,NA,NA,Egypt,0,0,Convalescent Plasma,0
NCT04816656,8/3/2020,2/1/2021,Interventional,An Integrated Digital PROM-platform for Cancer Patients During the COVID-19 Pandemic,Completed,Not Applicable,Jessa Hospital,NA,NA,NA,NA,NA,NA,Belgium,0,1,ePROMs assessment,0
NCT04816084,11/5/2020,12/1/2020,Interventional,SERUR: COVID-19 Serological Survey of Staff From the University Reims-Champagne Ardennes,Completed,Not Applicable,Université de Reims Champagne-Ardenne,NA,NA,NA,NA,NA,NA,France,0,0,Anti-SARS-CoV2 Serology,0
NCT04815096,4/15/2021,3/1/2023,Interventional,Imaging Immune Activation in COVID-19,Recruiting,Early Phase 1,"CellSight Technologies, Inc.",NA,NA,NA,NA,NA,NA,United States,0,3,[18F]F-AraG (2'-deoxy-2'-fluoro-9-β-D-arabinofuranosylguanine),0
NCT04815057,11/2/2020,11/23/2020,Interventional,The Effects of Wellness Training Given to Fifth Grade Students During the Covid-19 Epidemic Period,Completed,Not Applicable,Saglik Bilimleri Universitesi,NA,NA,NA,NA,NA,NA,Turkey,0,3,Wellness Education,0
NCT04813796,3/11/2021,4/13/2022,Interventional,"A Study to Evaluate Safety, Reactogenicity, and Immunogenicity of mRNA-1283 and mRNA-1273 Vaccines in Healthy Adults Between 18 Years and 55 Years of Age to Prevent COVID-19","Active, not recruiting",Phase 1,"ModernaTX, Inc.",NA,NA,NA,NA,NA,NA,United States,0,3,mRNA-1283|mRNA-1273|Placebo,1
NCT04813471,1/20/2021,3/20/2021,Interventional,Managing Endothelial Dysfunction in Critically Ill COVID-19 Patients at LAUMCRH,Recruiting,Phase 3,Lebanese American University Medical Center,NA,NA,NA,NA,NA,NA,Lebanon,0,0,Endothelial Protocol,0
NCT04813718,6/2/2021,5/1/2022,Interventional,Post COVID-19 Syndrome and the Gut-lung Axis,Recruiting,Not Applicable,Medical University of Graz,NA,NA,NA,NA,NA,NA,Austria,0,1,Omni-Biotic Pro Vi 5|Placebo,0
NCT04813562,3/23/2021,7/30/2021,Interventional,Immunogenicity and Safety of Recombinant COVID-19 Vaccine (CHO Cells),Recruiting,Phase 2,Jiangsu Province Centers for Disease Control and Prevention,NA,NA,NA,NA,NA,NA,China,0,1,"a middle-dose recombinant COVID-19 vaccine (CHO Cell) (18-59 years) at the schedule of day 0, 28, 56|a high-dose recombinant COVID-19 vaccine (CHO Cell) (18-59 years) at the schedule of day 0, 28, 56|a middle-dose recombinant COVID-19 vaccine (CHO Cell) (60-85 years) at the schedule of day 0, 28, 56|a high-dose recombinant COVID-19 vaccine (CHO Cell) (60-85 years) at the schedule of day 0, 28, 56|a middle-dose placebo (18-59 years) at the schedule of day 0, 28, 56|a high-dose placebo (18-59 years) at the schedule of day 0, 28, 56|a middle-dose placebo (60-85 years) at the schedule of day 0, 28, 56|a high-dose placebo (60-85 years) at the schedule of day 0, 28, 56",1
NCT04811664,3/24/2021,12/22/2021,Interventional,A Study of SARS CoV-2 Infection and Potential Transmission in Individuals Immunized With Moderna COVID-19 Vaccine,Recruiting,Phase 3,National Institute of Allergy and Infectious Diseases (NIAID),NA,NA,NA,NA,NA,NA,United States,0,5,Moderna COVID-19 Vaccine,1
NCT04811859,1/10/2021,1/10/2022,Interventional,The Effect of Inspiratory Muscle Training in Post COVID-19 Patients,Recruiting,Not Applicable,Istinye University,NA,NA,NA,NA,NA,NA,Turkey,0,0,Inspiratory Muscle Training,0
NCT04811339,9/2/2020,8/31/2023,Interventional,Studies of COVID-19 Patients Treated With Oral Bismuth Subsalicylate (Pepto-Bismol),Recruiting,Phase 4,University of Louisville,NA,NA,NA,NA,NA,NA,United States,0,1,open label BSS (pepto Bismol),0
NCT04810949,8/5/2020,3/1/2021,Interventional,Vitamine D3 Supplementation in Patients With Serum Values +/- 20ng/ml,Terminated,Not Applicable,Hospital Clinica Nova,patients enrolled got vaccinated vs COVID-19 and Influenza,NA,NA,NA,NA,NA,Mexico,0,0,Vitamine D3 supplementation|Diet and sun exposure,0
NCT04810689,3/1/2021,3/1/2022,Interventional,"Pilot Trial of XFBD, a TCM, in Persons With COVID-19",Recruiting,Phase 2,University of Southern California,NA,NA,NA,NA,NA,NA,United States,0,0,Xuanfei Baidu Granules|Placebo,0
NCT04810637,11/1/2020,6/30/2021,Interventional,A Study to Evaluate the Safety and Efficacy of GX-I7 in Elderly Patients With Asymptomatic or Mild Symptoms of COVID-19,Recruiting,Phase 2,PT Kalbe Genexine Biologics,NA,NA,NA,NA,NA,NA,Indonesia,0,1,GX-I7,0
NCT04809974,7/22/2021,12/31/2022,Interventional,Clinical Trial of Niagen to Examine Recovery in People With Persistent Cognitive and Physical Symptoms After COVID-19 Illness (Long-COVID),Recruiting,Phase 4,Massachusetts General Hospital,NA,NA,NA,NA,NA,NA,United States,0,2,Niagen,0
