nct_id,start_date.x,primary_completion_date.x,study_type.x,brief_title.x,overall_status.x,phase.x,source.x,why_stopped.x,pubmed_links,ctg_links,Abstract,Registry,Total_pubs,country,Has_Results,Number_of_updates,intervention,vaccine_trial_flag
NCT04644172,11/1/2020,11/30/2023,Interventional,Improving Thinking in Everyday Life After Covid-19,Recruiting,Not Applicable,University of Alabama at Birmingham,NA,NA,NA,NA,NA,NA,United States,0,1,Speed of Processing Training|Instrumental Activities of Daily Living Shaping|Transfer Package from CI Therapy|Usual Care,0
NCT04682197,12/14/2021,11/30/2022,Interventional,Cereset Research In Healthcare Workers During COVID-19,Recruiting,Not Applicable,Wake Forest University Health Sciences,NA,NA,NA,NA,NA,NA,United States,0,9,Cereset Research,0
NCT04377672,5/28/2020,9/1/2021,Interventional,Human Convalescent Plasma for High Risk Children Exposed or Infected With SARS-CoV-2 (COVID-19),Completed,Phase 1,Johns Hopkins University,NA,NA,NA,NA,NA,NA,United States,0,5,Anti-SARS-CoV-2 Human Convalescent Plasma,0
NCT04519216,7/31/2020,10/30/2021,Interventional,Breastfeeding Education in the Time of COVID-19,Completed,Not Applicable,"University of California, Davis",NA,NA,NA,NA,NA,NA,United States,0,2,Telesimulation,0
NCT05022472,7/16/2021,12/31/2022,Interventional,Project 2VIDA! COVID-19 Vaccine Intervention Delivery for Adults in Southern California,Recruiting,Phase 4,"University of California, San Diego",NA,NA,NA,NA,NA,NA,United States,0,1,COVID-19 Individual Awareness and Education.|COVID-19 Community Outreach & Health Promotion.|COVID-19 Individual Health Education & Linkages to Medical and Supportive Services.|Pop-up community vaccination sites,1
NCT04345861,4/11/2020,2/9/2021,Interventional,Hydroxychloroquine Plus Azithromycin Versus Hydroxychloroquine for COVID-19 Pneumonia (COVIDOC Trial),Terminated,Phase 2/Phase 3,"University Hospital, Montpellier",halted prematurely.,NA,NA,NA,NA,NA,France,0,4,Hydroxychloroquine + placebo|hydroxychloroquine + azithromycin,0
NCT05160766,11/8/2021,4/30/2022,Interventional,Assessing Immune Response of Different COVID-19 Vaccines in Older Adults,Recruiting,Phase 2,University of Cologne,NA,NA,NA,NA,NA,NA,Germany,0,0,Comirnaty(BTN162b2)|Spikevax (mRNA-1273),1
NCT05132855,11/30/2021,4/30/2023,Interventional,The Immune Response of Heterologous Boost Third Dose of mRNA and Protein COVID-19 Vaccine,Recruiting,Phase 1/Phase 2,Chang Gung Memorial Hospital,NA,NA,NA,NA,NA,NA,Taiwan,0,1,BNT162b2|mRNA-1273|MCV COVID-19 vaccine,1
NCT05000216,8/13/2021,1/31/2022,Interventional,COVID-19 Booster Vaccine in Autoimmune Disease Non-Responders,Recruiting,Phase 2,National Institute of Allergy and Infectious Diseases (NIAID),NA,NA,NA,NA,NA,NA,United States,0,11,Moderna mRNA-1273|BNT162b2|Ad26.COV2.S|IS (MMF or MPA)|IS (MTX)|IS (B cell depletion therapy),1
NCT04967742,8/5/2021,8/22/2021,Interventional,"A Extension Study to Evaluate the Safety, Tolerability, and Immunogenicity of UB-612 COVID-19 Vaccine",Completed,Phase 1,"United Biomedical Inc., Asia",NA,NA,NA,NA,NA,NA,Taiwan,0,2,UB-612,1
NCT04880642,9/16/2021,2/28/2022,Interventional,A Trial to Investigate Recovery From COVID-19 With C21 in Adult Subjects,Recruiting,Phase 3,Vicore Pharma AB,NA,NA,NA,NA,NA,NA,United States|Argentina|Brazil|Colombia|Czechia|India|Peru|Philippines|Ukraine,0,5,C21|Placebo,0
NCT04805671,7/26/2021,1/31/2022,Interventional,Evaluation of ADG20 for the Treatment of Mild or Moderate COVID-19,Recruiting,Phase 2/Phase 3,"Adagio Therapeutics, Inc.",NA,NA,NA,NA,NA,NA,Argentina|Brazil|Bulgaria|Germany|Greece|Hungary|Poland|Romania|South Africa|Ukraine,0,15,ADG20|Normal saline,0
NCT04784559,6/4/2021,3/31/2022,Interventional,Trial to Determine the Efficacy/Safety of Plitidepsin vs Control in Patients With Moderate COVID-19 Infection,Recruiting,Phase 3,PharmaMar,NA,NA,NA,NA,NA,NA,Argentina|Brazil|Bulgaria|Colombia|France|Greece|Mexico|Peru|Portugal|Romania|South Africa|Spain|Turkey,0,13,Plitidepsin|Dexamethasone|Remdesivir|Favipiravir,0
NCT04690387,12/7/2020,1/13/2021,Interventional,"Dendritic Cell Vaccine, AV-COVID-19, to Prevent COVID-19 Infection",Completed,Phase 1,"Aivita Biomedical, Inc.",NA,NA,NA,NA,NA,NA,Indonesia,0,4,AV-COVID-19|GM-CSF,1
NCT04661813,3/1/2021,12/31/2022,Interventional,Assess and Adapt to the Impact of COVID-19 on CVD Self-Management and Prevention Care in Adults Living With HIV,Recruiting,Not Applicable,Case Western Reserve University,NA,NA,NA,NA,NA,NA,United States,0,2,EXTRA-CVD Virtual Care,0
NCT04545008,10/20/2020,6/2/2021,Interventional,Trial of Famotidine & N-Acetyl Cysteine for Outpatients With COVID-19,Terminated,Phase 1,Prisma Health-Upstate,Study was stopped due to poor accrual.,NA,NA,NA,NA,NA,United States,0,3,Famotidine|N-Acetyl cysteine,0
NCT04439071,7/9/2020,12/31/2021,Interventional,A Study to Evaluate Efficacy and Safety of PTC299 (Emvododstat) in Hospitalized Participants With Coronavirus (COVID-19),Recruiting,Phase 2/Phase 3,PTC Therapeutics,NA,NA,NA,NA,NA,NA,United States|Australia|Belgium|Brazil|Colombia|France|Mexico|Poland|Portugal|South Africa|Spain,0,9,PTC299|SOC|Placebo,0
NCT04378920,4/14/2020,8/24/2021,Interventional,"A Study of Liposomal Trans Crocetin, LEAF-4L6715, in Patients With Acute Respiratory Distress Syndrome Due to COVID-19, Sepsis or Other Causes",Completed,Phase 1/Phase 2,Institut de cancérologie Strasbourg Europe,NA,NA,NA,NA,NA,NA,France,0,8,LEAF-4L6715,0
NCT04390178,4/10/2020,6/30/2020,Interventional,Convalescent Plasma as Treatment for Acute Coronavirus Disease (COVID-19),Completed,Phase 1/Phase 2,Karolinska University Hospital,NA,NA,NA,NA,NA,NA,Sweden,0,1,SARS-CoV-2 convalescent plasma,0
NCT05135624,12/1/2021,3/31/2023,Interventional,SP16 as a Therapeutic for COVID-19 Induced ARDS,Recruiting,Phase 1/Phase 2,"Serpin Pharma, LLC",NA,NA,NA,NA,NA,NA,United States,0,1,SP16 (6mg)|Placebo|SP16 (12 mg),0
NCT05067933,10/1/2021,3/31/2022,Interventional,A Ph 2 Trial With an Oral Tableted COVID-19 Vaccine,Recruiting,Phase 2,Vaxart,NA,NA,NA,NA,NA,NA,United States,0,2,VXA-CoV2-1.1-S|Placebo Tablets,1
NCT04765449,9/15/2021,7/29/2022,Interventional,Transfer of Infection Fighting Immune Cells Generated in the Laboratory to High Risk Patients With COVID-19 Infection,Recruiting,Phase 1,Thomas Jefferson University,NA,NA,NA,NA,NA,NA,United States,0,10,Cytotoxic T Lymphocytes,0
NCT04911777,8/24/2021,12/31/2021,Interventional,"Proof of Principle Study to Evaluate the Safety, PK, Viral Shedding and Efficacy of Pentarlandir™ UPPTA for Patients With Early COVID-19",Recruiting,Phase 2,SyneuRx International (Taiwan) Corp,NA,NA,NA,NA,NA,NA,United States,0,6,Pentarlandir™ UPPTA|Placebo,0
NCT04518410,8/19/2020,12/31/2023,Interventional,ACTIV-2: A Study for Outpatients With COVID-19,Recruiting,Phase 2/Phase 3,National Institute of Allergy and Infectious Diseases (NIAID),NA,NA,NA,NA,NA,NA,United States|Argentina|Brazil|Canada|Costa Rica|Guatemala|Mexico|Philippines|Puerto Rico|South Africa,0,93,"bamlanivimab|Placebo (IV)|BRII-196/BRII-198|AZD7442 (IV)|AZD7442 (IM)|SNG001|Camostat|Placebo (IM)|Placebo (Inhaled solution)|Placebo (oral tablet)|BMS-986414 + BMS-986413|Placebo (SC injections)|SAB-185 (3,840 Units/kg)|SAB-185 (10,240 Units/kg)|CASIRIVIMAB + IMDEVIMAB",0
NCT04526912,8/28/2020,4/8/2021,Interventional,Treatment and Prevention of Acute Lung Injury (ALI) in Patients With COVID-19 Infection,Terminated,Phase 1,Viela Bio,Study met predefined futility criteria for efficacy endpoints.,NA,NA,NA,NA,NA,United States,0,6,VIB7734|Placebo,0
NCT04402944,7/5/2020,12/31/2021,Interventional,Pulmozyme to Improve COVID-19 ARDS Outcomes,Recruiting,Phase 2,Boston Children's Hospital,NA,NA,NA,NA,NA,NA,United States,0,4,Pulmozyme|Placebo,0
NCT04376593,5/1/2020,6/30/2022,Interventional,PET/CT Imaging in COVID-19 Patients,Enrolling by invitation,Early Phase 1,"University of California, Davis",NA,NA,NA,NA,NA,NA,United States,0,5,18F-αvβ6-BP,0
NCT05163496,12/15/2021,1/31/2023,Interventional,Frontline Clinician Psilocybin Study,Recruiting,Phase 1/Phase 2,University of Washington,NA,NA,NA,NA,NA,NA,United States,0,0,Psilocybin (Usona Institute)|Active placebo,0
NCT05164120,12/14/2021,4/1/2022,Interventional,"Safety, Tolerability, and Treatment Effect of Belnacasan in Patients With COVID-19",Recruiting,Phase 2,Medstar Health Research Institute,NA,NA,NA,NA,NA,NA,United States,0,0,Belnacasan|Placebo,0
NCT05163743,5/23/2021,12/31/2021,Interventional,Diet and COVID-19 Vaccination,Recruiting,Not Applicable,University of Roma La Sapienza,NA,NA,NA,NA,NA,NA,Italy,0,0,Low Calorie Ketogenic Diet,1
NCT05163730,11/1/2021,5/31/2022,Interventional,Clinical Evaluation of the Panbio™ COVID-19/ Flu A&B Rapid Panel,Recruiting,Not Applicable,Abbott Rapid Diagnostics Jena GmbH,NA,NA,NA,NA,NA,NA,United States,0,0,COVID-19/ Flu A&B Rapid Panel,0
NCT05163613,1/1/2021,4/1/2021,Interventional,Use of Low-frequency Magnetic Fields in the Hybrid Treatment of COVID-19 Patients,"Active, not recruiting",Not Applicable,Medical University of Lodz,NA,NA,NA,NA,NA,NA,Poland,0,0,magnetostimulation,0
NCT04969250,8/25/2021,7/31/2022,Interventional,Vaccination for Recovered Inpatients With COVID-19 (VATICO),Recruiting,Phase 4,National Institute of Allergy and Infectious Diseases (NIAID),NA,NA,NA,NA,NA,NA,United States|Nigeria|Spain|Switzerland|Uganda,0,12,Moderna mRNA-1273 COVID-19 vaccine|Pfizer BNT162b2 COVID-19 vaccine,1
NCT05140005,12/6/2021,12/14/2021,Interventional,GlowTest COVID-19 Antigen Home Test Kit QRI Use Study,Completed,Not Applicable,Arion Bio,NA,NA,NA,NA,NA,NA,United States,0,2,GlowTest COVID-19 Antigen Home Test,0
NCT05074446,11/15/2021,1/1/2022,Interventional,Stereotype Threat Effect On the Performance of the Non-Intensivist Physicians Assigned in Covid-19 Intensive Care Unit,Recruiting,Not Applicable,Hacettepe University,NA,NA,NA,NA,NA,NA,Turkey,0,2,stereotype threat manipulation,0
NCT04959760,6/3/2021,3/30/2022,Interventional,BinaxNow COVID-19 IgG Rapid Test Device and Antibody Self Test,Recruiting,Not Applicable,Abbott Rapid Diagnostics Jena GmbH,NA,NA,NA,NA,NA,NA,United States,0,1,The BinaxNOW™ Antibody Tests measure IgG antibodies against SARS-CoV-2.,0
NCT04813497,2/5/2021,12/25/2021,Interventional,Monitoring of COVID-19 Seroprevalence Among GHdC Staff Members,Enrolling by invitation,Not Applicable,Grand Hôpital de Charleroi,NA,NA,NA,NA,NA,NA,Belgium,0,2,Serology to determine SARS-CoV-2 infection,0
NCT04858425,4/30/2021,12/31/2021,Interventional,Safety and Efficacy of Niclosamide in Patients With COVID-19 With Gastrointestinal Infection,Recruiting,Phase 2,"AzurRx BioPharma, Inc.",NA,NA,NA,NA,NA,NA,United States|India|Ukraine,0,14,Niclosamide|Placebo,0
NCT04843761,4/20/2021,10/31/2022,Interventional,ACTIV-3b: Therapeutics for Severely Ill Inpatients With COVID-19,Recruiting,Phase 3,National Institute of Allergy and Infectious Diseases (NIAID),NA,NA,NA,NA,NA,NA,United States,0,29,Remdesivir|Remdesivir Placebo|Aviptadil|Aviptadil Placebo|Corticosteroid,0
NCT04816669,4/1/2021,12/1/2021,Interventional,"A Study to Evaluate Safety, Tolerability, & Immunogenicity of Multiple Formulations of BNT162b2 Against COVID-19 in Healthy Adults",Completed,Phase 3,BioNTech SE,NA,NA,NA,NA,NA,NA,United States,0,7,BNT162b2,1
NCT04762186,12/8/2021,2/1/2023,Interventional,Viable Human SARS-CoV-2 Specific T Cell Transfer in Patients at Risk for Severe COVID-19,Recruiting,Phase 1,Universitätsklinikum Köln,NA,NA,NA,NA,NA,NA,Germany,0,1,human SARS-CoV 2 specific T lymphocytes,0
NCT04760730,7/13/2021,3/1/2022,Interventional,Safety and Immunogenicity Study in Adults of AZD1222 and rAd26-S Administered as Heterologous Prime Boost Regimen for the Prevention of Coronavirus Disease 2019 (COVID-19),Recruiting,Phase 1/Phase 2,R-Pharm,NA,NA,NA,NA,NA,NA,United Arab Emirates,0,1,AZD1222|rAd26-S,0
NCT04681092,4/6/2021,2/28/2022,Interventional,Anti-COVID19 AKS-452 Fusion Protein Vaccine - ACT Study,"Active, not recruiting",Phase 1/Phase 2,University Medical Center Groningen,NA,NA,NA,NA,NA,NA,Netherlands,0,4,AKS-452,1
NCT04662086,4/23/2021,8/31/2022,Interventional,COVID-19 Outpatient Pragmatic Platform Study (COPPS) - Master Protocol,Recruiting,Phase 2,Stanford University,NA,NA,NA,NA,NA,NA,United States,0,5,Acebilustat|Camostat,0
NCT04662073,4/23/2021,8/31/2022,Interventional,COVID-19 Outpatient Pragmatic Platform Study (COPPS) - Camostat Sub-Protocol,"Active, not recruiting",Phase 2,Stanford University,NA,NA,NA,NA,NA,NA,United States,0,5,Camostat|Placebo,0
NCT04662060,4/23/2021,8/31/2022,Interventional,COVID-19 Outpatient Pragmatic Platform Study (COPPS) - Acebilustat Sub-Protocol,Recruiting,Phase 2,Stanford University,NA,NA,NA,NA,NA,NA,United States,0,4,Acebilustat|Placebo,0
NCT04591015,2/1/2021,12/31/2021,Interventional,Dulce Digital-COVID Aware (DD-CA) Discharge Texting Platform for US/Mexico Border Hispanics With Diabetes + COVID-19,Recruiting,Phase 3,Scripps Whittier Diabetes Institute,NA,NA,NA,NA,NA,NA,United States,0,6,Hospital: DD-CA|Hospital: Usual Care (UC),0
NCT04588428,6/21/2021,6/15/2024,Interventional,"Safety, Tolerability and Immunogenicity of INO-4700 for MERS-CoV in Healthy Volunteers",Recruiting,Phase 2,Inovio Pharmaceuticals,NA,NA,NA,NA,NA,NA,Jordan|Kenya|Lebanon,0,15,INO-4700|Placebo|CELLECTRA™ 2000,0
NCT04568122,11/20/2020,11/30/2022,Interventional,"Rapid Turnaround, Home-based Saliva Testing for COVID-19",Recruiting,Not Applicable,Stanford University,NA,NA,NA,NA,NA,NA,United States,0,11,Saliva test kit,0
NCT04466800,7/30/2020,7/31/2022,Interventional,Functional and Respiratory Rehabilitation and Nutritional Care of COVID-19 Patients (RECOVER-19),Recruiting,Not Applicable,Rennes University Hospital,NA,NA,NA,NA,NA,NA,France,0,7,Intervention group_rehabilitation program,0
NCT04373707,5/13/2020,4/29/2021,Interventional,Weight-Adjusted vs Fixed Low Doses of Low Molecular Weight Heparin For Venous Thromboembolism Prevention in COVID-19,Completed,Phase 4,"Central Hospital, Nancy, France",NA,NA,NA,NA,NA,NA,France,0,6,Enoxaparin|Enoxaparin,0
NCT04431453,7/21/2020,2/28/2022,Interventional,"Study to Evaluate the Safety, Tolerability, Pharmacokinetics, and Efficacy of Remdesivir (GS-5734™) in Participants From Birth to < 18 Years of Age With Coronavirus Disease 2019 (COVID-19)",Recruiting,Phase 2/Phase 3,Gilead Sciences,NA,NA,NA,NA,NA,NA,United States|Italy|Spain|United Kingdom,0,34,Remdesivir,0
NCT04372628,6/1/2020,4/1/2022,Interventional,Trial of Early Therapies During Non-hospitalized Outpatient Window for COVID-19,"Active, not recruiting",Phase 2,Vanderbilt University Medical Center,NA,NA,NA,NA,NA,NA,United States,0,10,Lopinavir/Ritonavir 400 mg/100 mg|Placebo,0
NCT05166005,4/1/2020,8/23/2021,Interventional,Severity of COVID-19 and Vitamin D Supplementation,"Active, not recruiting",Phase 4,"Federal State Budgetary Institution, V. A. Almazov Federal North-West Medical Research Centre, of the Ministry of Health",NA,NA,NA,NA,NA,NA,Russian Federation,0,0,vitamin D,0
NCT05165966,10/20/2021,2/20/2022,Interventional,"Safety and Immunogenicity Study of Booster Vaccination in Different Doses of COVID-19 Vaccine (Vero Cell),Inactivated for Prevention of COVID-19","Active, not recruiting",Phase 4,"Sinovac Biotech Co., Ltd",NA,NA,NA,NA,NA,NA,China,0,0,"High-dosage of COVID-19 vaccine (Vero cell), Inactivated|Medium-dose COVID-19 Vaccine(Vero Cell),Inactivated",1
NCT05096832,11/3/2021,1/27/2023,Interventional,Recombinant SARS-CoV-2 Fusion Protein Vaccine (V-01) Booster Study,Recruiting,Phase 3,Livzon Pharmaceutical Group Inc.,NA,NA,NA,NA,NA,NA,Pakistan,0,2,Recombinant SARS-CoV-2 Fusion Protein Vaccine (V-01)|Blank Preparation of Recombinant SARS-CoV-2 Fusion Protein Vaccine (V-01),1
NCT04952857,8/1/2021,11/30/2021,Interventional,"Short Term, High Dose Vitamin D Supplementation in Moderate to Severe COVID-19 Disease",Completed,Phase 4,Postgraduate Institute of Medical Education and Research,NA,NA,NA,NA,NA,NA,India,0,3,cholecalciferol 6 lakh IU,0
NCT04904471,6/15/2021,2/28/2022,Interventional,A Global Phase III Clinical Trial of Recombinant COVID- 19 Vaccine (Sf9 Cells),Enrolling by invitation,Phase 3,"WestVac Biopharma Co., Ltd.",NA,NA,NA,NA,NA,NA,Indonesia|Kenya|Mexico|Philippines,0,7,Recombinant COVID-19 vaccine (Sf9 cells)|Placebo control,1
NCT04899232,7/6/2021,6/30/2022,Interventional,Antithrombin III in Infectious Disease Caused by COVID-19,Recruiting,Phase 2,University of Miami,NA,NA,NA,NA,NA,NA,United States,0,5,Antithrombin III,0
NCT04821934,3/26/2021,12/20/2021,Interventional,Tele-rehabilitation Program After Hospitalization for COVID-19,Completed,Not Applicable,Istituti Clinici Scientifici Maugeri SpA,NA,NA,NA,NA,NA,NA,Italy,0,2,TR|TSu,0
NCT04860297,4/16/2021,3/31/2023,Interventional,A Study to Evaluate Safety and Immunogenicity of mRNA-1273 Vaccine to Prevent COVID-19 in Adult Organ Transplant Recipients and in Healthy Adult Participants,Recruiting,Phase 3,"ModernaTX, Inc.",NA,NA,NA,NA,NA,NA,United States,0,4,mRNA-1273,1
NCT04792567,4/19/2021,1/17/2022,Interventional,Exploring the Immune Response to SARS-CoV-2 modRNA Vaccines in Patients With Secondary Progressive Multiple Sclerosis (AMA-VACC),"Active, not recruiting",Phase 4,Novartis,NA,NA,NA,NA,NA,NA,Germany,0,5,BAF312|Baseline disease modifying therapies (DMTs),1
NCT04788459,2/25/2021,12/31/2021,Interventional,"Safety and Immunogenicity of COVID-eVax, a Candidate Plasmid DNA Vaccine for COVID-19, in Healthy Adult Volunteers","Active, not recruiting",Phase 1/Phase 2,Takis,NA,NA,NA,NA,NA,NA,Italy,0,3,COVID-eVax|Cliniporator® and EPSGun,1
NCT04482595,11/11/2020,3/31/2022,Interventional,BIO 300 Oral Suspension in Discharged COVID-19 Patients,Recruiting,Phase 2,Humanetics Corporation,NA,NA,NA,NA,NA,NA,United States,0,8,BIO 300 Oral Suspension|Placebo,0
NCT04401410,11/4/2020,10/12/2021,Interventional,Anti-SARS Cov-2 T Cell Infusions for COVID 19,Terminated,Phase 1,Baylor College of Medicine,"Due to trial's eligibility criteria and the low census of hospitalized COVID-19 patients meeting eligibility criteria, the Sponsor will be unable to enroll a meaningful number of patients in this single-center trial in a reasonable time frame.",NA,NA,NA,NA,NA,United States,0,6,Dose Finding Phase (MTD)|Partially HLA-matched SARS-CoVSTs|Routine care (no SARS-CoVSTs),0
NCT05167227,11/30/2021,7/31/2024,Interventional,Does a Technology Enabled Multi-disciplinary Team-based Care Model for the Management of Long COVID and Other Fatiguing Illnesses Improve Clinical Care of Patients and Represent a Sustainable Approach Within a Federally Qualified Health Center?,Recruiting,Not Applicable,Family Health Centers of San Diego,NA,NA,NA,NA,NA,NA,United States,0,0,Extension for Community Healthcare Outcomes,0
NCT05167357,3/18/2021,11/30/2022,Interventional,Multicentric Evaluation of the Impact on Hypoxia Sensitivity of Patients With COVID-19,Recruiting,Not Applicable,Institut de Formation et de Recherche en Médecine de Montagne,NA,NA,NA,NA,NA,NA,France,0,0,COVID19,0
NCT05167279,12/17/2021,9/30/2022,Interventional,A Study of JS026 and JS026 Together With JS016 for Treatment of COVID-19,Recruiting,Phase 1,"Shanghai Junshi Bioscience Co., Ltd.",NA,NA,NA,NA,NA,NA,China,0,1,JS026/placebo|JS016/placebo,0
NCT05166915,12/31/2021,6/30/2022,Interventional,"Respiratory COVID-19: A Randomized, Sham-Controlled Study",Recruiting,Not Applicable,"Aytu BioPharma, Inc.",NA,NA,NA,NA,NA,NA,Spain,0,1,UVA Light Emitting Catheter|Sham Control Catheter,0
NCT05148949,12/22/2021,5/10/2022,Interventional,Study on Three Doses of an Inactivated COVID-19 Vaccine in Chinese Pulmonary Tuberculosis Patients,Recruiting,Phase 4,Jiangsu Province Centers for Disease Control and Prevention,NA,NA,NA,NA,NA,NA,China,0,1,Standard dosage inactivated vaccine|Double dosage inactivated vaccine,1
NCT05148832,5/1/2021,8/20/2021,Interventional,Administration of Systemic Corticosteroids and the Recovery of Gustatory Functions in Patients With COVID-19,Completed,Not Applicable,Fayoum University,NA,NA,NA,NA,NA,NA,Egypt,0,1,Administration of Systemic Corticosteroid,0
NCT05143567,11/1/2021,11/1/2026,Interventional,Hemostasis and Inflammation in COVID19 Patients With Venous and Arterial Thrombotic Complications,Recruiting,Not Applicable,Ryazan State Medical University,NA,NA,NA,NA,NA,NA,Russian Federation,0,1,standard of care anticoagulation in absence of thrombotic complications|standard of care anticoagulation in presence of thrombotic complications|standard of care anticoagulation in combination with elastic compression,0
NCT05135585,12/1/2021,10/12/2022,Interventional,Evaluation of the Post-vaccination Immune Response to COVID-19 in the New Caledonian Population,Recruiting,Not Applicable,Institut Pasteur,NA,NA,NA,NA,NA,NA,New Caledonia,0,1,Blood sample collection|Questionnaires,1
NCT05097053,10/7/2021,3/31/2022,Interventional,A Heterologous 3rd COVID-19 Vaccine of MVC-COV1901 to Evaluate Immunogenicity and Safety in Adults With ChAdOx1-nCov-19,Recruiting,Phase 4,Taoyuan General Hospital,NA,NA,NA,NA,NA,NA,Taiwan,0,1,MVC-COV1901(3 Months)|MVC-COV1901(6 Months),1
NCT05063825,10/6/2021,12/13/2021,Interventional,Understanding Reactions to Emotional Material in the Media During COVID-19 - Study 2,Completed,Not Applicable,Uppsala University,NA,NA,NA,NA,NA,NA,Sweden,0,2,Simple cognitive task intervention|Attention placebo,0
NCT05087173,10/11/2021,1/31/2022,Interventional,Effectiveness of Using Interactive Consulting System to Enhance Decision Aids of COVID-19 Vaccination,Recruiting,Not Applicable,Sun Yat-sen University,NA,NA,NA,NA,NA,NA,China,0,1,Chatbot,1
NCT05067894,12/10/2021,3/31/2022,Interventional,Safety and Immunogenicity of SARS-CoV-2 Protein Subunit Recombinant Vaccine,Recruiting,Phase 1,PT Bio Farma,NA,NA,NA,NA,NA,NA,Indonesia,0,4,SARS-CoV-2 Protein Subunit Recombinant Vaccine|SARS-CoV-2 Inactivated Vaccine,1
NCT05057923,7/10/2021,10/20/2021,Interventional,The Development of a COVID19 Oral Vaccine Consisting of Bacillus Subtilis Spores,Completed,Not Applicable,DreamTec Research Limited,NA,NA,NA,NA,NA,NA,Hong Kong,1,1,Bacillus subtilis,1
NCT05036941,11/13/2021,2/28/2022,Interventional,A Trial of Two Mask Systems in Preventing SARS CoV-2 in Healthcare Workers (HCW),Recruiting,Not Applicable,Ascend Performance Materials,NA,NA,NA,NA,NA,NA,India,0,2,Acteev™ Masks|Comparison Masks,0
NCT05007080,9/27/2021,8/31/2023,Interventional,A Study to Evaluate Different Dose Levels of Ad26.COV2.S in Healthy Adolescents From 12 to 17 Years Inclusive,Recruiting,Phase 2/Phase 3,Janssen Vaccines & Prevention B.V.,NA,NA,NA,NA,NA,NA,Argentina|Brazil|Colombia|India|Mexico|Philippines|South Africa|Thailand,0,5,Ad26.COV2.S,0
NCT04992273,9/13/2021,11/17/2022,Interventional,COVID-19 Administration of Single-Dose Subcutaneous Anti- Spike(s) SARS-CoV-2 Monoclonal Antibodies Casirivimab and Imdevimab in High-Risk Pediatric Participants Under 12 Years of Age,Recruiting,Phase 2,Regeneron Pharmaceuticals,NA,NA,NA,NA,NA,NA,United States,0,2,casirivimab+imdevimab,0
NCT04956887,8/3/2021,1/31/2022,Interventional,Cognitive Training in Survivors of Covid-19: A Randomized Trial,Recruiting,Not Applicable,Vanderbilt University Medical Center,NA,NA,NA,NA,NA,NA,United States,0,2,AKL-T01|Control Group,0
NCT04955626,7/1/2021,9/20/2023,Interventional,"To Evaluate the Safety, Tolerability, Efficacy and Immunogenicity of a Booster Dose of BNT162b2 Against COVID-19 in Participants ≥12 Years of Age.","Active, not recruiting",Phase 3,BioNTech SE,NA,NA,NA,NA,NA,NA,United States|Brazil|Canada|South Africa,0,9,BNT162b2|Placebo,1
NCT05057169,11/18/2021,3/31/2023,Interventional,Randomized Trial of COVID-19 Booster Vaccinations (Cobovax Study),Recruiting,Phase 4,The University of Hong Kong,NA,NA,NA,NA,NA,NA,Hong Kong,0,3,BNT162b2|CoronaVac,1
NCT04988035,7/21/2021,10/31/2022,Interventional,ACTIV-5 / Big Effect Trial (BET-C) for the Treatment of COVID-19,Recruiting,Phase 2,National Institute of Allergy and Infectious Diseases (NIAID),NA,NA,NA,NA,NA,NA,United States,0,33,Danicopan|Placebo|Remdesivir,0
NCT04987957,12/8/2021,5/31/2022,Interventional,Effect Of Musıc Therapy On Anxıety Levels In COVID-19 Pandemıc,Recruiting,Not Applicable,Abant Izzet Baysal University,NA,NA,NA,NA,NA,NA,Turkey,0,4,Music Therapy,0
NCT04951310,6/7/2021,8/14/2021,Interventional,COVID-19 Vaccinations With a Sweepstakes,Completed,Not Applicable,University of Pennsylvania,NA,NA,NA,NA,NA,NA,United States,0,1,Philly Vax Sweepstakes,1
NCT04939428,8/11/2021,4/3/2022,Interventional,Study of MK-4482 for Prevention of Coronavirus Disease 2019 (COVID-19) in Adults (MK-4482-013),Recruiting,Phase 3,Merck Sharp & Dohme Corp.,NA,NA,NA,NA,NA,NA,United States|Argentina|Brazil|Colombia|Dominican Republic|France|Guatemala|Hungary|Japan|Mexico|Philippines|Romania|Russian Federation|South Africa|Spain|Turkey|Ukraine,0,20,Molnupiravir|Placebo,0
NCT04935476,11/22/2021,3/31/2022,Interventional,Dapsone Coronavirus SARS-CoV-2 Trial (DAP-CORONA) COVID-19,Recruiting,Phase 3,McGill University Health Centre/Research Institute of the McGill University Health Centre,NA,NA,NA,NA,NA,NA,United States|Canada,0,3,Dapsone 85 mg PO BID|Placebo 85 mg PO BID,0
NCT04920890,5/16/2021,7/20/2021,Interventional,Radiofrequency Intervention in Post COVID-19 Patients,Completed,Not Applicable,Clinica Gema Leon,NA,NA,NA,NA,NA,NA,Spain,0,2,Radiofrequency therapy|Placebo without radiofrequency.,0
NCT04908722,6/18/2021,4/18/2022,Interventional,A Study to Evaluate Dose Levels of Ad26.COV2.S Administered as a Two-dose Schedule in Healthy Adults,Recruiting,Phase 3,Janssen Vaccines & Prevention B.V.,NA,NA,NA,NA,NA,NA,United States|Brazil|Germany|Poland|South Africa,0,9,Ad26.COV2.S,0
NCT04894305,5/25/2021,12/8/2021,Interventional,A Study of Ad26.COV2.S in Healthy Adults (COVID-19),Completed,Phase 1,Janssen Vaccines & Prevention B.V.,NA,NA,NA,NA,NA,NA,Netherlands,0,7,Ad26.COV2.S,0
