nct_id,start_date.x,primary_completion_date.x,study_type.x,brief_title.x,overall_status.x,phase.x,source.x,why_stopped.x,pubmed_links,ctg_links,Abstract,Registry,Total_pubs,country,Has_Results,Number_of_updates,intervention,vaccine_trial_flag
NCT04381988,5/7/2020,4/21/2021,Interventional,A Study of Hydroxychloroquine vs Placebo to Prevent COVID-19 Infection in Patients Receiving Radiotherapy,Terminated,Phase 2,Memorial Sloan Kettering Cancer Center,The study was terminated based results of other studies and use of the new vaccine.,NA,NA,NA,NA,NA,United States,1,3,Hydroxychloroquine|Placebo|Radiation therapy,0
NCT04498442,5/22/2020,10/22/2020,Interventional,"A Study on Prevalence, Protection and Recovery From COVID-19 in Seasoned Yoga Practitioners in Comparison to Age and Gender Matched Controls",Completed,Not Applicable,Beth Israel Deaconess Medical Center,NA,NA,NA,NA,NA,NA,United States,0,4,Simha Kriya|Reading a Book,0
NCT04496245,8/24/2020,6/30/2021,Interventional,Reducing Acute Severe Respiratory Events in Health Care Workers During the Covid-19 Pandemic With OM85,"Active, not recruiting",Phase 3,The University of Queensland,NA,NA,NA,NA,NA,NA,Australia,0,3,Broncho-Vaxom®,0
NCT04498936,7/15/2020,10/30/2020,Interventional,Sofosbuvir/Ledipasvir and Nitazoxanide for Treatment of COVID-19,Completed,Phase 4,Assiut University,NA,NA,NA,NA,NA,NA,Egypt,0,1,Sofosbuvir and Ledipasvir|Nitazoxanide,0
NCT04497649,7/1/2020,4/1/2021,Interventional,Sofosbuvir Containing Regimens in Treatment of COVID 19 Patients,Recruiting,Phase 2/Phase 3,Tanta University,NA,NA,NA,NA,NA,NA,Egypt,0,2,Sofosbuvir|Daclatasvir,0
NCT04495543,12/1/2020,8/31/2021,Interventional,Mitigating Suicide Risk With Single Session 'Brief Skills for Safer Living',Recruiting,Not Applicable,Unity Health Toronto,NA,NA,NA,NA,NA,NA,Canada,0,1,Brief Skills for Safer Living,0
NCT04497454,5/8/2020,7/1/2021,Interventional,Mechanical Ventilation Strategy for Coronavirus Disease 2019 (COVID-19),Recruiting,Not Applicable,University of Sao Paulo General Hospital,NA,NA,NA,NA,NA,NA,Brazil,0,0,EIT-Group|ARDSNet,0
NCT04497272,8/7/2020,8/7/2021,Interventional,Assesment of the Metabolomic Signature in COVID-19 Patients,"Active, not recruiting",Not Applicable,Centre Hospitalier Universitaire de Nice,NA,NA,NA,NA,NA,NA,France,0,2,COVID-19 patients,0
NCT04494867,8/19/2020,12/31/2020,Interventional,Core Warming in COVID-19 Patients Undergoing Mechanical Ventilation,Recruiting,Not Applicable,Sharp HealthCare,NA,NA,NA,NA,NA,NA,United States,0,3,Core Warming|Standard of Care,0
NCT04495803,9/1/2020,8/1/2022,Interventional,Augmented CBGT for Perinatal Anxiety During a Global Pandemic (COVID-19),Recruiting,Not Applicable,St. Joseph's Healthcare Hamilton,NA,NA,NA,NA,NA,NA,Canada,0,1,Cognitive Behavioural Group Therapy for Perinatal Anxiety,0
NCT04495101,7/29/2020,4/26/2021,Interventional,Study to Evaluate the Safety and Efficacy of Prolastin in Hospitalized Subjects With COVID-19,Completed,Phase 2,Grifols Therapeutics LLC,NA,NA,NA,NA,NA,NA,Spain,0,6,Prolastin|Standard Medical Treatment,0
NCT04495842,10/1/2020,12/31/2021,Interventional,The Effect of Aromatherapy on COVID-19-induced Anxiety,Recruiting,Not Applicable,Franklin School of Integrative Health Sciences,NA,NA,NA,NA,NA,NA,United States,0,2,Essential Oil Blend|Control Blend,0
NCT04494646,9/8/2020,1/8/2021,Interventional,BARCONA: A Study of Effects of Bardoxolone Methyl in Participants With SARS-Corona Virus-2 (COVID-19),Completed,Phase 2,NYU Langone Health,NA,NA,NA,NA,NA,NA,United States,0,6,Bardoxolone Methyl|Placebo,0
NCT04489446,8/19/2020,4/30/2021,Interventional,Sildenafil in COVID-19,Completed,Phase 1/Phase 2,Universidad Nacional Andres Bello,NA,NA,NA,NA,NA,NA,Chile,0,5,Sildenafil|Placebo,0
NCT04494204,8/7/2020,12/1/2020,Interventional,Effect of a Combination of Treatment of Reginmune Capsule and Immunofree Tablets in the Treatment of Mild to Moderate COVID-19 Patients,Completed,Phase 2/Phase 3,Nutrin GmbH,NA,NA,NA,NA,NA,NA,India,0,4,Immunofree tablets and Reginmune capsule,0
NCT04494399,7/29/2020,7/1/2022,Interventional,IFN Beta-1b and Ribavirin for Covid-19,Recruiting,Phase 2,The University of Hong Kong,NA,NA,NA,NA,NA,NA,Hong Kong,0,0,Interferon beta-1b|Ribavirin,0
NCT04494386,7/23/2020,10/30/2021,Interventional,Umbilical Cord Lining Stem Cells (ULSC) in Patients With COVID-19 ARDS,Recruiting,Phase 1/Phase 2,"Restem, LLC.",NA,NA,NA,NA,NA,NA,United States,0,3,Umbilical Cord Lining Stem Cells (ULSC)|Placebo (carrier control),0
NCT04492358,10/22/2020,10/31/2021,Interventional,"Treatment for Moderate/Severe COVID-19 in a Fragile and Vulnerable Population, Admitted to a Geriatric Hospital Unit or in a Transicional Care Center",Recruiting,Phase 2/Phase 3,Fundacion Clinic per a la Recerca Biomédica,NA,NA,NA,NA,NA,NA,Spain,0,1,Prednisone tablet|Colchicine|standard of care,0
NCT04493359,7/25/2020,9/28/2021,Interventional,Switch of Renin-Angiotensin System Inhibitors in Patients With Covid-19,Terminated,Phase 2/Phase 3,University of Sao Paulo,Dificulteis in enrolling patients,NA,NA,NA,NA,NA,Brazil,0,2,Renin-angiotensin system inhibitors,0
NCT04489628,8/1/2020,6/1/2021,Interventional,Tele-health Enabled Clinical Trial for COVID-19,Terminated,Phase 1/Phase 2,University Hospitals Cleveland Medical Center,Unable to overcome hurdles to study recruitment,NA,NA,NA,NA,NA,United States,0,3,Vitamin D3 or Placebo|Doctella telehealth monitoring,0
NCT04490200,3/1/2021,12/30/2021,Interventional,Effectiveness of a Novel Respirator With Chitosan Nanoparticles,Recruiting,Not Applicable,University of Brasilia,NA,NA,NA,NA,NA,NA,Brazil,0,2,VESTA respirator|Conventional N95 respirator,0
NCT04490473,7/24/2020,3/24/2021,Interventional,Turkish of the SARS-CoV-2 Anxiety Scale,Recruiting,Not Applicable,Eskisehir Osmangazi University,NA,NA,NA,NA,NA,NA,Turkey,0,1,survey work,0
NCT04492410,7/21/2020,5/12/2021,Interventional,COVID-19 Infection Screening in Cancer Patients (NEOSCREENCOVID),"Active, not recruiting",Not Applicable,Centre Antoine Lacassagne,NA,NA,NA,NA,NA,NA,France,0,2,rapid serological test,0
NCT04492228,9/1/2020,12/31/2020,Interventional,Eucaloric Ketogenic Diet in COVID-19 Cytokine Storm Syndrome,Recruiting,Not Applicable,Ospedale Policlinico San Martino,NA,NA,NA,NA,NA,NA,Italy,0,1,Ketogenic diet,0
NCT04492254,9/15/2020,7/31/2021,Interventional,Early Prophylactic Low-molecular-weight Heparin (LMWH) in Symptomatic COVID-19 Positive Patients,Recruiting,Phase 3,Thrombosis Research Institute,NA,NA,NA,NA,NA,NA,Australia|Belgium|South Africa,0,1,Enoxaparin,0
NCT04490278,9/29/2020,6/30/2021,Interventional,CoV-PICS: A Virtual Post-ICU Clinic,Completed,Not Applicable,Washington University School of Medicine,NA,NA,NA,NA,NA,NA,United States,0,5,Medical Record Review - Inpatient Treatment|Online Questionnaires,0
NCT04487691,12/8/2020,6/1/2021,Interventional,Nebulized PL for Post-COVID-19 Syndrome,"Active, not recruiting",Not Applicable,"Regenexx, LLC",NA,NA,NA,NA,NA,NA,United States,0,3,Nebulized Platelet Lysate|Nebulized Sterile Saline,0
NCT04492501,4/1/2020,7/20/2020,Interventional,Investigational Treatments for COVID-19 in Tertiary Care Hospital of Pakistan,Completed,Not Applicable,UNICEF,NA,NA,NA,NA,NA,NA,Pakistan,0,0,Therapeutic Plasma exchange|Convalescent Plasma|Tocilizumab|Remdesivir|Mesenchymal stem cell therapy,0
NCT04490824,10/1/2020,3/30/2021,Interventional,Inhalation of KELEA Excellerated Water in Covid-19 Infected Individuals,Recruiting,Not Applicable,Institute of Progressive Medicine,NA,NA,NA,NA,NA,NA,United States,0,4,KELEA Excellerated Water|Water Without an Elevated Level of KELEA,0
NCT04492527,7/28/2020,4/30/2021,Interventional,Student-delivered Telehealth Program for COVID-19 Education and Health Promotion,Completed,Not Applicable,University of British Columbia,NA,NA,NA,NA,NA,NA,Canada,0,3,Telehealth coaching sessions,0
NCT04490850,7/15/2020,12/15/2021,Interventional,COVID-19 Seroprevalence Study in French Guiana,Recruiting,Not Applicable,Institut Pasteur,NA,NA,NA,NA,NA,NA,French Guiana,0,1,Blood sample,0
NCT04488796,9/7/2020,12/16/2020,Interventional,STAND UP to SARS-CoV-2 (COVID-19): Using Behavioural Economics to Reduce Sedentary Behaviour in At-home Office Workers,Completed,Not Applicable,"Western University, Canada",NA,NA,NA,NA,NA,NA,Canada,0,5,Assigned Strategies: Opt-in|Assigned Strategies: Active Choice|Assigned Strategies: Enhanced Active Choice|Choice of Assignment: Opt-in|Choice of Assignment: Active Choice|Choice of Assignment: Enhanced Active Choice,0
NCT04488081,7/31/2020,7/24/2022,Interventional,I-SPY COVID-19 TRIAL: An Adaptive Platform Trial for Critically Ill Patients,Recruiting,Phase 2,QuantumLeap Healthcare Collaborative,NA,NA,NA,NA,NA,NA,United States,0,6,Remdesivir|Pulmozyme|IC14|Celecoxib Famotidine|Narsoplimab|Aviptadil Acetate|Cyclosporine,0
NCT04483960,7/28/2020,12/31/2021,Interventional,Australasian COVID-19 Trial (ASCOT) ADAptive Platform Trial,Recruiting,Phase 3,University of Melbourne,NA,NA,NA,NA,NA,NA,Australia,0,3,Nafamostat Mesilate|Hyperimmune Globulin|Enoxaparin|Dalteparin|Tinzaparin,0
NCT04485169,4/1/2020,7/31/2020,Interventional,Therapeutic Plasma Exchange for Coronavirus Disease-2019 Triggered Cytokine Release Storm;,Completed,Not Applicable,UNICEF,NA,NA,NA,NA,NA,NA,Pakistan,0,1,Therapeutic Plasma Exchange,0
NCT04486313,8/13/2020,2/8/2021,Interventional,Trial to Evaluate Efficacy and Safety of Nitazoxanide in the Treatment of Mild or Moderate COVID-19,Completed,Phase 3,Romark Laboratories L.C.,NA,NA,NA,NA,NA,NA,United States,0,5,Nitazoxanide|Placebo|Vitamin Super B-Complex,0
NCT04487574,7/25/2020,10/29/2020,Interventional,A Study to Assess the Efficacy and Safety of XC221 in Patients With COVID-19,Completed,Phase 3,RSV Therapeutics LLC,NA,NA,NA,NA,NA,NA,Russian Federation,0,2,XC221|Placebo,0
NCT04487639,7/10/2020,7/31/2021,Interventional,Presence of SARS-CoV-2 in Semen: Impact on Fertility Preservation in Male Oncological Patients ?,Recruiting,Not Applicable,"University Hospital, Clermont-Ferrand",NA,NA,NA,NA,NA,NA,France,0,0,"SARS-CoV-2 research in nasopharyngeal swab, sperm and serologics",0
NCT04487886,11/18/2020,2/28/2022,Interventional,Duvelisib Ameliorates Manifestations of Pneumonia in Established Novel Coronavirus Infection (COVID-19),Recruiting,Phase 2,Emory University,NA,NA,NA,NA,NA,NA,United States,0,2,Duvelisib|Placebo,0
NCT04483752,6/8/2020,12/24/2021,Interventional,Predicting the Progression to Chronic Fibrosis of Lung Lesions Related to Covid-19 Infection From Chest CT Images,Recruiting,Not Applicable,Centre Chirurgical Marie Lannelongue,NA,NA,NA,NA,NA,NA,France,0,1,CHEST CT SCAN,0
NCT04487444,9/10/2020,3/31/2022,Interventional,Thymalfasin (Thymosin Alpha 1) to Treat COVID-19 Infection,Recruiting,Phase 2,Rhode Island Hospital,NA,NA,NA,NA,NA,NA,United States,0,4,Thymalfasin,0
NCT04487171,7/21/2020,7/31/2021,Interventional,Screening for Postpartum Depression and Associated Risk Factors Among Women Who Deliver in Four Hospital in France During the COVID-19 Epidemic,Recruiting,Not Applicable,"Centre Hospitalier Universitaire, Amiens",NA,NA,NA,NA,NA,NA,France,0,0,NA,0
NCT04483830,6/5/2020,8/6/2020,Interventional,Suloexide in the Treatment of Early Stages of COVID-19,Completed,Phase 2/Phase 3,Clinedem,NA,NA,NA,NA,NA,NA,Mexico,0,2,Sulodexide|Placebo,0
NCT04481685,7/20/2020,2/25/2021,Interventional,"A Trial of Aclaris Therapeutics, Inc. (ATI)-450 in Patients With Moderate-severe Novel Coronavirus Disease 2019 (COVID-19)",Completed,Phase 2,University of Kansas Medical Center,NA,NA,NA,NA,NA,NA,United States,0,4,ATI-450|Placebo,0
NCT04482387,7/24/2020,7/1/2021,Interventional,DigiVis: Self-testing Vision App for Telephone Consultations,Recruiting,Not Applicable,Cambridge University Hospitals NHS Foundation Trust,NA,NA,NA,NA,NA,NA,United Kingdom,0,1,DigiVis visual acuity app,0
NCT04483271,10/2/2020,12/15/2020,Interventional,The Effect of Omega-3 on Selected Cytokines Involved in Cytokine Storm,Enrolling by invitation,Not Applicable,Applied Science Private University,NA,NA,NA,NA,NA,NA,Jordan,0,1,300 mg of omega3-FA,0
NCT04483635,2/8/2021,5/4/2021,Interventional,PRevention of COVID-19 With Oral Vitamin D Supplemental Therapy in Essential healthCare Teams,Terminated,Phase 3,St. Justine's Hospital,"A premature discontinuation was recommended by the Data Safety Monitoring Board and agreed upon by the principal investigator, because the significantly lower recruitment than planned, in the context of mass vaccination of the target population.",NA,NA,NA,NA,NA,Canada,0,3,Placebo|Vitamin D,0
NCT04480957,8/4/2020,1/29/2021,Interventional,Ascending Dose Study of Investigational SARS-CoV-2 Vaccine ARCT-021 in Healthy Adult Subjects,Completed,Phase 1/Phase 2,"Arcturus Therapeutics, Inc.",NA,NA,NA,NA,NA,NA,Singapore,0,2,ARCT-021 Dose 1|ARCT-021 Dose 2|ARCT-021 Dose 3|ARCT-021 Dose 4|ARCT-021 Dose Regimen 1|ARCT-021 Dose Regimen 2|Placebo,1
NCT04482621,9/14/2020,2/28/2022,Interventional,Decitabine for Coronavirus (COVID-19) Pneumonia- Acute Respiratory Distress Syndrome (ARDS) Treatment: DART Trial,Recruiting,Phase 2,Johns Hopkins University,NA,NA,NA,NA,NA,NA,United States,0,4,Decitabine|Placebo Saline,0
NCT04477993,8/14/2020,3/29/2021,Interventional,Ruxolitinib for Acute Respiratory Disorder Syndrome Due to COVID-19,Terminated,Phase 2/Phase 3,University of Sao Paulo General Hospital,Low accrual,NA,NA,NA,NA,NA,Brazil,0,1,Janus Kinase Inhibitor (ruxolitinib)|Placebo,0
NCT04480112,6/2/2020,6/11/2021,Interventional,Impact of Covid-19 on Frequent Social Interaction Through Communication Technologies in the Cognitive Status of Socially-isolated Older Adults,Completed,Not Applicable,Boston University,NA,NA,NA,NA,NA,NA,United States,0,5,Technology based social interactions|No research related technology based social interactions,0
NCT04479540,5/26/2020,2/26/2022,Interventional,Assessment of the Risk of Pulmonary Embolism and Coagulation Profile in Patients With COVID-19 Lung Disease,Recruiting,Not Applicable,Hopital Foch,NA,NA,NA,NA,NA,NA,France,0,2,Angiography scanner,0
NCT04482673,7/31/2020,12/31/2021,Interventional,Vitamin D Supplementation in the Prevention and Mitigation of COVID-19 Infection,Recruiting,Phase 4,Medical University of South Carolina,NA,NA,NA,NA,NA,NA,United States,0,1,Daily Vitamin D3|Daily placebo|Bolus vitamin D3|Bolus placebo,0
NCT04476992,7/24/2020,7/17/2021,Interventional,Nitric Oxide Therapy for COVID-19 Patients With Oxygen Requirement,"Active, not recruiting",Phase 1/Phase 2,Tomsk National Research Medical Center of the Russian Academy of Sciences,NA,NA,NA,NA,NA,NA,Russian Federation,0,4,Nitric Oxide-Sessions|Nitric Oxide-Continuous and Sessions,0
NCT04478019,7/7/2020,4/30/2022,Interventional,SHIELD Study: Using Naso-oropharyngeal Antiseptic Decolonization to Reduce COVID-19 Viral Shedding,Recruiting,Early Phase 1,"University of Wisconsin, Madison",NA,NA,NA,NA,NA,NA,United States,0,4,10% Povidone-iodine nasal decolonization swab plus 0.12% CHG oral rinse,0
NCT04477083,7/15/2020,8/15/2020,Interventional,"Development and Validation of ""Ready-to-Use"" Inhalable Forms of Hydroxychloroquine for Treatment of COVID-19","Active, not recruiting",Not Applicable,Mansoura University,NA,NA,NA,NA,NA,NA,Egypt,0,0,inhalable hydroxychloroquine (HCQ)|supportive and symptomatic treatment,0
NCT04472559,6/16/2021,10/1/2021,Interventional,Acupressure for COVID-19 Related Quality of Life and Stress,Recruiting,Not Applicable,"University of California, Los Angeles",NA,NA,NA,NA,NA,NA,United States,0,4,Self-acupressure,0
NCT04476979,7/16/2020,6/30/2021,Interventional,Comparison of Tocilizumab Plus Dexamethasone vs. Dexamethasone for Patients With Covid-19,Recruiting,Phase 2,Assistance Publique - Hôpitaux de Paris,NA,NA,NA,NA,NA,NA,French Guiana,0,2,Tocilizumab|Dexamethasone,0
NCT04475913,7/11/2018,7/11/2020,Interventional,Digital vs Analog Impression in Cases of All-on-4 - Prosthesis,Completed,Not Applicable,October University for Modern Sciences and Arts,NA,NA,NA,NA,NA,NA,Egypt,0,1,DIG Axial|DIG Tilted|CIG Axial|CIG Tilted,0
NCT04470544,7/28/2020,9/15/2022,Interventional,Camostat Mesilate Treating Patients With Hospitalized Patients With COVID-19,Recruiting,Phase 2,Academic and Community Cancer Research United,NA,NA,NA,NA,NA,NA,United States,0,3,Camostat Mesilate|Standard of Care,0
NCT04475120,4/15/2020,7/2/2020,Interventional,Efficacy and Safety of Liposomal Lactoferrin in COVID-19 Patients With Mild-to-Moderate Disease and in COVID-19 Asymptomatic Patients,Completed,Phase 2/Phase 3,University of Rome Tor Vergata,NA,NA,NA,NA,NA,NA,Italy,0,2,liposomal lactoferrin|SOC therapy,0
NCT04473274,5/21/2020,11/1/2020,Interventional,"GlitazOne Treatment for Coronavirus HypoxiA, a Safety and Tolerability Open Label With Matching Cohort Pilot Study",Completed,Phase 4,Samaritan Health Services,NA,NA,NA,NA,NA,NA,United States,0,2,Pioglitazone,0
NCT04470869,6/12/2020,10/12/2021,Interventional,Impact on the OLAF Intervention to Prevent Post Traumatic Disorders During the Confinement.,"Active, not recruiting",Not Applicable,"University Hospital, Toulouse",NA,NA,NA,NA,NA,NA,France,0,1,Phone call,0
NCT04473248,6/28/2020,8/30/2020,Interventional,Spartan COVID-19 System: Evaluation of Clinical Sample Collection,Completed,Not Applicable,Spartan Bioscience Inc.,NA,NA,NA,NA,NA,NA,Canada,0,1,Spartan COVID-19 System,0
NCT04470258,6/25/2020,8/30/2020,Interventional,Elmo Respiratory Support Project - COVID-19,Completed,Not Applicable,Escola de Saúde Pública do Ceará,NA,NA,NA,NA,NA,NA,Brazil,0,2,ELMO PROJECT AT COVID-19: STUDY IN HUMANS|ELMO PROJECT AT COVID-19: PROOF OF CONCEPT AND USABILITY,0
NCT04468646,6/15/2020,7/15/2020,Interventional,To Determine the Efficacy of Neurokinin 1 Receptor Antagonist as a Therapeutic Tool Against Cytokine Storm and Respiratory Failure in Covid-19 Patients,Recruiting,Phase 3,University of Health Sciences Lahore,NA,NA,NA,NA,NA,NA,Pakistan,0,0,NK-1R antagonist,0
NCT04468139,6/20/2020,7/20/2020,Interventional,"The Study of Quadruple Therapy Zinc, Quercetin, Bromelain and Vitamin C on the Clinical Outcomes of Patients Infected With COVID-19",Recruiting,Phase 4,"Ministry of Health, Saudi Arabia",NA,NA,NA,NA,NA,NA,Saudi Arabia,0,0,Quercetin|bromelain|Zinc|Vitamin C,0
NCT04466540,5/12/2020,7/28/2021,Interventional,Randomized Placebo-controlled Trial of Hydroxychloroquine in Outpatient Cases With Coronavirus Disease 2019 (COVID-19),"Active, not recruiting",Phase 4,Hospital Alemão Oswaldo Cruz,NA,NA,NA,NA,NA,NA,Brazil,0,2,Hydroxychloroquine|Placebo,0
NCT04466098,7/30/2020,12/1/2021,Interventional,Multiple Dosing of Mesenchymal Stromal Cells in Patients With ARDS (COVID-19),"Active, not recruiting",Phase 2,"Masonic Cancer Center, University of Minnesota",NA,NA,NA,NA,NA,NA,United States,0,3,Mesenchymal stromal cells|Placebo,0
NCT04464395,7/1/2020,3/1/2021,Interventional,Study of CPI-006 as Immunotherapy for Hospitalized COVID-19 Patients,Completed,Phase 1,"Corvus Pharmaceuticals, Inc.",NA,NA,NA,NA,NA,NA,United States,0,6,CPI-006|Standard of Care,0
NCT04466683,8/28/2020,12/31/2021,Interventional,Low-Dose Radiotherapy For Patients With SARS-COV-2 (COVID-19) Pneumonia,Recruiting,Phase 2,Ohio State University Comprehensive Cancer Center,NA,NA,NA,NA,NA,NA,United States|Colombia,0,2,Low dose radiation 35 cGy|High dose radiation 100 cGy,0
NCT04467840,8/21/2020,7/18/2021,Interventional,"Opaganib, a Sphingosine Kinase-2 (SK2) Inhibitor in COVID-19 Pneumonia",Completed,Phase 2/Phase 3,RedHill Biopharma Limited,NA,NA,NA,NA,NA,NA,United States|Brazil|Colombia|Israel|Italy|Mexico|Peru|Poland|Russian Federation|United Kingdom,0,47,Opaganib|Placebo,0
NCT04463602,7/25/2020,1/25/2021,Interventional,Desidustat in the Management of COVID-19 Patients,Completed,Phase 2,Cadila Healthcare Limited,NA,NA,NA,NA,NA,NA,Mexico,0,7,Desidustat|Standard of Care,0
NCT04463472,6/29/2020,9/28/2020,Interventional,Study of COVID-19 DNA Vaccine (AG0301-COVID19),Completed,Phase 1/Phase 2,"AnGes, Inc.",NA,NA,NA,NA,NA,NA,Japan,0,6,AG0301-COVID19|AG0301-COVID19,1
NCT04468009,6/25/2020,1/19/2021,Interventional,Treatment of Critically Ill Patients With Covid-19 With Convalescent Plasma,Completed,Phase 2,Hospital de Infecciosas Francisco Javier Muniz,NA,NA,NA,NA,NA,NA,Argentina,0,5,Convalescent plasma,0
NCT04461925,5/2/2020,5/2/2021,Interventional,Treatment of Coronavirus COVID-19 Pneumonia (Pathogen SARS-CoV-2) With Cryopreserved Allogeneic P_MMSCs and UC-MMSCs,Recruiting,Phase 1/Phase 2,Institute of Cell Therapy,NA,NA,NA,NA,NA,NA,Ukraine,0,0,Placenta-Derived MMSCs; Cryopreserved Placenta-Derived Multipotent Mesenchymal Stromal Cells|Antibiotics|Hormones|Anticoagulant Therapy|Оxygen therapy,0
NCT04465604,2/1/2021,11/1/2021,Interventional,Hypertonic Saline for COVID-19 Symptoms,Recruiting,Not Applicable,King Faisal Specialist Hospital & Research Center,NA,NA,NA,NA,NA,NA,Saudi Arabia,0,1,NA,0
NCT04460443,8/1/2020,8/1/2021,Interventional,Sofosbuvir in Treatment of COVID 19,Recruiting,Phase 2/Phase 3,Tanta University,NA,NA,NA,NA,NA,NA,Egypt,0,2,sofosbuvir|Sofosbuvir ledipsavir|Daclatasvir,0
NCT04460690,7/13/2020,3/31/2021,Interventional,"Rapid, Onsite COVID-19 Detection",Completed,Not Applicable,"University of Wisconsin, Madison",NA,NA,NA,NA,NA,NA,United States,0,6,Rapid Onsite COVID-19 Detection,0
NCT04459455,8/19/2020,10/15/2020,Interventional,"Project H-COVID: Evaluating Hyper-Brief, Online Materials During the COVID-19 Pandemic",Completed,Not Applicable,Stony Brook University,NA,NA,NA,NA,NA,NA,United States,0,2,Contain COVID Anxiety SSI|Remain COVID Free SSI,0
NCT04462757,5/28/2020,8/31/2020,Interventional,SCIL-1Ra in COVID-19 Feasibility & PK/PD,Terminated,Phase 2,University of Manchester,Lack of patients in the trial population from which to recruit and lack of funding,NA,NA,NA,NA,NA,United Kingdom,0,4,Anakinra 100Mg/0.67Ml Inj Syringe,0
NCT04459962,6/29/2020,1/7/2021,Interventional,Covid-19 Breath Test,Completed,Not Applicable,Ancon Technologies Ltd,NA,NA,NA,NA,NA,NA,United Kingdom,0,1,Breath Test & Cheek Swab,0
NCT04457609,7/31/2020,8/31/2020,Interventional,Administration of Allogenic UC-MSCs as Adjuvant Therapy for Critically-Ill COVID-19 Patients,Recruiting,Phase 1,Indonesia University,NA,NA,NA,NA,NA,NA,Indonesia,0,0,Oseltamivir|Azithromycin|Umbilical Cord Mesenchymal Stem Cells,0
NCT04459325,6/1/2020,7/20/2020,Interventional,Tigerase® Efficacy and Safety as Part of Complex Therapy in Patients With COVID-19,Completed,Phase 3,AO GENERIUM,NA,NA,NA,NA,NA,NA,Russian Federation,0,1,Tigerase® and best available care|Best available care,0
NCT04457726,7/1/2020,3/31/2021,Interventional,Part Two of Novel Adoptive Cellular Therapy With SARS-CoV-2 Specific T Cells in Patients With Severe COVID-19,Recruiting,Phase 1/Phase 2,KK Women's and Children's Hospital,NA,NA,NA,NA,NA,NA,Singapore,0,1,SARS-CoV-2 Specific T Cells,0
NCT04458519,7/16/2020,5/27/2021,Interventional,Efficacy of Intranasal Probiotic Treatment to Reduce Severity of Symptoms in COVID19 Infection,Completed,Not Applicable,Centre hospitalier de l'Université de Montréal (CHUM),NA,NA,NA,NA,NA,NA,Canada,0,4,Probiorinse|Saline solution,0
NCT04458298,8/11/2020,6/2/2022,Interventional,A Study to Evaluate OP-101 (Dendrimer N-acetyl-cysteine) in Severe Coronavirus Disease 2019 (COVID-19) Patients,"Active, not recruiting",Phase 2,"Orpheris, Inc.",NA,NA,NA,NA,NA,NA,United States,0,6,OP-101|Placebo,0
NCT04456452,7/27/2020,9/8/2020,Interventional,Study of Ampion for the Treatment of Adult COVID-19 Patients Requiring Oxygen Supplementation,Completed,Phase 1,Ampio Pharmaceuticals. Inc.,NA,NA,NA,NA,NA,NA,United States,0,5,Ampion|Standard of Care,0
NCT04456413,11/6/2020,11/30/2021,Interventional,Convalescent Plasma as Treatment for Subjects With Early COVID-19 Infection,Recruiting,Phase 2,Hackensack Meridian Health,NA,NA,NA,NA,NA,NA,United States,0,3,Convalescent Plasma|Best Supportive Care,0
NCT04453774,11/1/2020,2/28/2022,Interventional,At Home Monitoring for Patients With Covid19,Recruiting,Not Applicable,"University Health Network, Toronto",NA,NA,NA,NA,NA,NA,Canada,0,3,Covidfree@home,0
NCT04456361,4/16/2020,10/15/2020,Interventional,Use of Mesenchymal Stem Cells in Acute Respiratory Distress Syndrome Caused by COVID-19,"Active, not recruiting",Early Phase 1,Instituto de Medicina Regenerativa,NA,NA,NA,NA,NA,NA,Mexico,0,1,Mesenchymal Stem Cells derived from Wharton Jelly of Umbilical cords,0
NCT04456062,8/4/2020,7/20/2021,Interventional,Using Caring Contacts to Reduce Psychiatric Morbidity Following Hospitalization During the COVID-19 Pandemic,"Active, not recruiting",Not Applicable,Sunnybrook Health Sciences Centre,NA,NA,NA,NA,NA,NA,Canada,0,3,Caring Contacts,0
NCT04455308,7/21/2020,10/19/2020,Interventional,COVID-19 and Chilblains,Completed,Not Applicable,Rennes University Hospital,NA,NA,NA,NA,NA,NA,France,0,2,Biological sample collection,0
NCT04480138,8/11/2020,7/31/2021,Interventional,Pegylated Interferon - α2b With SARSCoV- 2 (COVID-19),"Active, not recruiting",Phase 2,Cadila Healthcare Limited,NA,NA,NA,NA,NA,NA,Mexico,0,5,Pegylated Interferon-α2b|Standard of Care,0
NCT04481633,9/9/2020,3/31/2022,Interventional,Efficacy of Pre-exposure Treatment With Hydroxy-Chloroquine on the Risk and Severity of COVID-19 Infection,Recruiting,Not Applicable,"University Hospital, Toulouse",NA,NA,NA,NA,NA,NA,France,0,3,COVID 19 serology|COVID 19 Self-Questionnaire,0
NCT04476680,9/1/2020,4/28/2021,Interventional,Influence of Military Preventive Policy for reCruit Training on COVID-19 Seroconversion,Recruiting,Not Applicable,Royal Centre for Defence Medicine,NA,NA,NA,NA,NA,NA,United Kingdom,0,1,Vitamin D,0
NCT04478539,6/1/2020,6/1/2021,Interventional,Extracorporeal Blood Purification as a Treatment Modality for COVID-19,Recruiting,Not Applicable,Zan Mitrev Clinic,NA,NA,NA,NA,NA,NA,North Macedonia,0,0,Extracorporeal blood purification using the oXiris® (AN69ST) hemofilter,0
