NCT04371419,NA,2020-04-28,2021-05-28,NA,2021-07-24,2020-04-28,2020-05-01,Actual,2021-07-24,2021-07-27,Actual,NA,NA,NA,2021-07-24,2021-07-27,Actual,"May 13, 2020",Actual,2020-05-13,July 2021,2021-07-31,"May 26, 2020",Actual,2020-05-26,"May 24, 2020",Actual,2020-05-24,NA,Interventional,NA,Any intervention was indeed an arm that included each sub arm of different types of message that we tested against a control and pre-specified in our study protocol and analysis plan to combine arms for analysis.,COVID-19 Health Messaging to Underserved Communities,COVID-19 Health Messaging to Underserved Communities,Completed,NA,Not Applicable,14267,Actual,"National Bureau of Economic Research, Inc.",NA,17,NA,NA,FALSE,NA,NA,NA,FALSE,FALSE,FALSE,NA,NA,NA,NA,NA,"Generally, social scientists post code and de-identified data when the findings are published","To be determined, if published alongside the paper data and code may be gated.",NA,Yes,"Generally, economists will post code and de-identified data when the findings are published",2021-12-04T22:28:34Z,2021-12-04T22:28:34Z,163
NCT04370834,NA,2020-04-30,2021-05-28,NA,2021-07-16,2020-04-30,2020-05-01,Actual,2021-05-28,2021-06-04,Actual,NA,NA,NA,2021-07-16,2021-07-20,Actual,"May 28, 2020",Actual,2020-05-28,July 2021,2021-07-31,"January 14, 2021",Actual,2021-01-14,"January 14, 2021",Actual,2021-01-14,NA,Interventional,NA,NA,Tocilizumab for Patients With Cancer and COVID-19 Disease,Tocilizumab in Hospitalized Cancer Patients With Coronavirus 2019 (SARS-CoV-2) and Severe Complications of Coronavirus Disease 19 (COVID-19),Terminated,NA,Phase 2,1,Actual,National Cancer Institute (NCI),NA,1,NA,Other - Randomized data no longer support continuation,NA,NA,NA,NA,TRUE,TRUE,FALSE,NA,NA,NA,NA,NA,NA,NA,https://grants.nih.gov/policy/sharing.htm,Yes,"NCI is committed to sharing data in accordance with NIH policy. For more details on how clinical trial data is shared, access the link to the NIH data sharing policy page.",2021-12-04T22:28:35Z,2021-12-04T22:28:35Z,171
NCT04390022,NA,2020-05-07,2020-12-09,NA,2020-12-10,2020-05-14,2020-05-15,Actual,2020-12-10,2020-12-17,Actual,NA,NA,NA,2020-12-10,2020-12-17,Actual,"July 31, 2020",Actual,2020-07-31,December 2020,2020-12-31,"October 9, 2020",Actual,2020-10-09,"September 17, 2020",Actual,2020-09-17,NA,Interventional,SAINT,NA,Sars-CoV-2/COVID-19 Ivermectin Navarra-ISGlobal Trial,Pilot Study to Evaluate the Potential of Ivermectin to Reduce COVID-19 Transmission,Completed,NA,Phase 2,24,Actual,"Clinica Universidad de Navarra, Universidad de Navarra",NA,2,NA,NA,FALSE,NA,NA,NA,FALSE,FALSE,FALSE,NA,NA,NA,NA,NA,NA,NA,NA,NA,NA,2021-12-04T22:28:26Z,2021-12-04T22:28:26Z,389
NCT04401579,NA,2020-05-22,2021-02-25,NA,2021-04-22,2020-05-22,2020-05-26,Actual,2021-04-22,2021-04-26,Actual,NA,NA,NA,2021-04-22,2021-04-26,Actual,"May 8, 2020",Actual,2020-05-08,April 2020,2020-04-30,"July 31, 2020",Actual,2020-07-31,"July 31, 2020",Actual,2020-07-31,NA,Interventional,NA,NA,Adaptive COVID-19 Treatment Trial 2 (ACTT-2),"A Multicenter, Adaptive, Randomized Blinded Controlled Trial of the Safety and Efficacy of Investigational Therapeutics for the Treatment of COVID-19 in Hospitalized Adults (ACTT-2)",Completed,NA,Phase 3,1033,Actual,National Institute of Allergy and Infectious Diseases (NIAID),NA,2,NA,NA,FALSE,NA,NA,NA,NA,TRUE,FALSE,NA,NA,FALSE,NA,NA,NA,NA,NA,NA,NA,2021-12-04T22:28:18Z,2021-12-04T22:28:18Z,256
NCT04365699,NA,2020-04-25,2021-09-01,NA,2021-09-10,2020-04-25,2020-04-28,Actual,2021-09-10,2021-09-16,Actual,NA,NA,NA,2021-09-10,2021-09-16,Actual,"April 8, 2020",Actual,2020-04-08,September 2021,2021-09-30,"January 31, 2021",Actual,2021-01-31,"January 31, 2021",Actual,2021-01-31,NA,Interventional,NA,NA,Cardiovascular Effects of COVID-19,A Single-center Registry and Embedded Interventional Study of the Effects of COVID-19 With and Without Treatment With AT-001 on Cardiac Structure and Function in Patients Hospitalized for Management of COVID-19 Infection,Completed,NA,Phase 2,81,Actual,NYU Langone Health,NA,3,NA,NA,FALSE,NA,NA,NA,TRUE,TRUE,FALSE,NA,NA,TRUE,NA,NA,Beginning 9 months and ending 36 months following article publication,Requests may be directed to Stuart.Katz@nyulangone.org.,NA,Yes,The de-identified participant data from the final research dataset used in the published manuscript will be shared upon reasonable request beginning 9 months and ending 36 months following article publication or as required by a condition of awards and agreements supporting the research provided the investigator who proposes to use the data executes a data use agreement with NYU Langone Health. Requests may be directed to Stuart.Katz@nyulangone.org. The protocol and statistical analysis plan will be made available on Clinicaltrials.gov only as required by federal regulation or as a condition of awards and agreements supporting the research.,2021-12-04T22:28:38Z,2021-12-04T22:28:38Z,115
NCT04365153,NA,2020-04-24,2021-04-05,NA,2021-04-13,2020-04-24,2020-04-28,Actual,2021-04-13,2021-04-15,Actual,NA,NA,NA,2021-04-13,2021-04-15,Actual,"April 24, 2020",Actual,2020-04-24,April 2021,2021-04-30,"April 1, 2021",Actual,2021-04-01,"February 2, 2021",Actual,2021-02-02,NA,Interventional,NA,NA,Canakinumab in Covid-19 Cardiac Injury (The Three C Study),Canakinumab to Reduce Deterioration of Cardiac and Respiratory Function in SARSCoV2 Associated Acute Myocardial Injury With Heightened Inflammation,Completed,NA,Phase 2,45,Actual,The Cleveland Clinic,NA,3,NA,NA,FALSE,NA,NA,NA,TRUE,TRUE,FALSE,NA,NA,NA,NA,NA,NA,NA,NA,No,NA,2021-12-04T22:28:38Z,2021-12-04T22:28:38Z,265
NCT04382066,NA,2020-05-07,2021-08-02,NA,2021-09-22,2020-05-08,2020-05-11,Actual,2021-09-22,2021-09-24,Actual,NA,NA,NA,2021-09-22,2021-09-24,Actual,"May 12, 2020",Actual,2020-05-12,September 2021,2021-09-30,"November 26, 2020",Actual,2020-11-26,"November 26, 2020",Actual,2020-11-26,NA,Interventional,APLICOV-PC,NA,Proof of Concept Study to Evaluate the Safety Profile of Plitidepsin in Patients With COVID-19,"Multicenter, Randomized, Parallel and Proof of Concept Study to Evaluate the Safety Profile of Three Doses of Plitidepsin in Patients With COVID-19 Requiring Hospitalization",Completed,NA,Phase 1,46,Actual,PharmaMar,NA,3,NA,NA,FALSE,NA,NA,NA,FALSE,FALSE,FALSE,NA,NA,NA,NA,NA,NA,NA,NA,Yes,Data of the final publication of the study will be shared upon request.,2021-12-04T22:28:30Z,2021-12-04T22:28:30Z,103
NCT04363736,NA,2020-04-21,2021-07-30,NA,2021-08-26,2020-04-24,2020-04-27,Actual,2021-08-26,2021-08-30,Actual,NA,NA,NA,2021-08-26,2021-08-30,Actual,"May 5, 2020",Actual,2020-05-05,August 2021,2021-08-31,"August 12, 2020",Actual,2020-08-12,"August 12, 2020",Actual,2020-08-12,NA,Interventional,MARIPOSA,NA,A Study to Investigate Intravenous Tocilizumab in Participants With Moderate to Severe COVID-19 Pneumonia,"A Phase-II, Open-Label, Randomized, Multicenter Study to Investigate the Pharmacodynamics, Pharmacokinetics, Safety, and Efficacy of 8 mg/kg or 4mg/kg Intravenous Tocilizumab in Patients With Moderate to Severe COVID-19 Pneumonia",Completed,NA,Phase 2,97,Actual,Hoffmann-La Roche,NA,2,NA,NA,FALSE,NA,NA,NA,NA,TRUE,FALSE,NA,NA,NA,NA,NA,NA,NA,NA,Yes,"Qualified researchers may request access to individual patient level data through the clinical study data request platform (www.vivli.org). Further details on Roche's criteria for eligible studies are available here (https://vivli.org/members/ourmembers/). For further details on Roche's Global Policy on the Sharing of Clinical Information and how to request access to related clinical study documents, see here (https://www.roche.com/research_and_development/who_we_are_how_we_work/clinical_trials/our_commitment_to_data_sharing.htm).",2021-12-04T22:28:37Z,2021-12-04T22:28:37Z,130
NCT04380688,NA,2020-05-07,2021-08-19,NA,2021-09-08,2020-05-07,2020-05-08,Actual,2021-09-08,2021-09-13,Actual,NA,NA,NA,2021-09-08,2021-09-13,Actual,"June 13, 2020",Actual,2020-06-13,September 2021,2021-09-30,"November 16, 2020",Actual,2020-11-16,"November 16, 2020",Actual,2020-11-16,NA,Interventional,CALAVI US,NA,Acalabrutinib Study With Best Supportive Care Versus Best Supportive Care in Subjects Hospitalized With COVID-19.,"A Phase 2, Open Label, Randomized Study of the Efficacy and Safety of Acalabrutinib With Best Supportive Care Versus Best Supportive Care in Subjects Hospitalized With COVID-19",Completed,NA,Phase 2,62,Actual,AstraZeneca,NA,2,NA,NA,FALSE,NA,NA,NA,TRUE,TRUE,FALSE,NA,NA,NA,NA,NA,"AstraZeneca will meet or exceed data availability as per the commitments made to the EFPIA Pharma Data Sharing Principles. For details of our timelines, please rerefer to our disclosure commitment at https://astrazenecagrouptrials.pharmacm.com/ST/Submission/Disclosure.","When a request has been approved AstraZeneca will provide access to the deidentified individual patient-level data in an approved sponsored tool . Signed Data Sharing Agreement (non-negotiable contract for data accessors) must be in place before accessing requested information. Additionally, all users will need to accept the terms and conditions of the SAS MSE to gain access. For additional details, please review the Disclosure Statements at https://astrazenecagrouptrials.pharmacm.com/ST/Submission/Disclosure.",https://astrazenecagroup-dt.pharmacm.com/DT/Home,Yes,"Qualified researchers can request access to anonymized individual patient-level data from AstraZeneca group of companies sponsored clinical trials via the request portal.

All request will be evaluated as per the AZ disclosure commitment: https://astrazenecagrouptrials.pharmacm.com/ST/Submission/Disclosure.",2021-12-04T22:28:31Z,2021-12-04T22:28:31Z,117
NCT04362813,NA,2020-04-24,2021-07-30,2021-02-08,2021-08-12,2020-04-24,2020-04-27,Actual,2021-08-12,2021-08-16,Actual,2021-08-12,2021-08-16,Actual,2021-08-12,2021-08-16,Actual,"April 30, 2020",Actual,2020-04-30,August 2021,2021-08-31,"December 22, 2020",Actual,2020-12-22,"September 16, 2020",Actual,2020-09-16,NA,Interventional,CAN-COVID,"While patient flow and baseline measure tables show 454 participants enrolled, only 451 randomized. 3 were ""mis-randomized"" i.e. assigned a randomization number in error and not treated.",Study of Efficacy and Safety of Canakinumab Treatment for CRS in Participants With COVID-19-induced Pneumonia,"Phase 3 Multicenter, Randomized, Double-blind, Placebo-controlled Study to Assess the Efficacy and Safety of Canakinumab on Cytokine Release Syndrome in Patients With COVID-19-induced Pneumonia (CAN-COVID)",Completed,NA,Phase 3,454,Actual,Novartis,NA,2,NA,NA,NA,NA,NA,NA,TRUE,TRUE,FALSE,NA,NA,NA,NA,NA,NA,NA,NA,Undecided,"Novartis is committed to sharing with qualified external researchers, access to patient-level data and supporting clinical documents from eligible studies. These requests are reviewed and approved by an independent review panel on the basis of scientific merit. All data provided is anonymized to respect the privacy of patients who have participated in the trial in line with applicable laws and regulations. This trial data availability is according to the criteria and process described on www.clinicalstudydatarequest.com.",2021-12-04T22:28:40Z,2021-12-04T22:28:40Z,144
NCT04346199,NA,2020-04-09,2021-09-08,NA,2021-09-15,2020-04-14,2020-04-15,Actual,2021-09-08,2021-09-13,Actual,NA,NA,NA,2021-09-15,2021-09-17,Actual,"June 12, 2020",Actual,2020-06-12,September 2021,2021-09-30,"November 17, 2020",Actual,2020-11-17,"November 17, 2020",Actual,2020-11-17,NA,Interventional,CALAVI,NA,Acalabrutinib Study With Best Supportive Care Versus Best Supportive Care in Subjects Hospitalized With COVID-19.,"A Phase 2, Open Label, Randomized Study of the Efficacy and Safety of Acalabrutinib With Best Supportive Care Versus Best Supportive Care in Subjects Hospitalized With COVID-19",Completed,NA,Phase 2,177,Actual,AstraZeneca,NA,2,NA,NA,FALSE,NA,NA,NA,TRUE,TRUE,FALSE,NA,NA,NA,NA,NA,"AstraZeneca will meet or exceed data availability as per the commitments made to the EFPIA Pharma Data Sharing Principles. For details of our timelines, please rerefer to our disclosure commitment at https://astrazenecagrouptrials.pharmacm.com/ST/Submission/Disclosure.","When a request has been approved AstraZeneca will provide access to the de-identified individual patient-level data in an approved sponsored tool . Signed Data Sharing Agreement (non-negotiable contract for data accessors) must be in place before accessing requested information. Additionally, all users will need to accept the terms and conditions of the SAS MSE to gain access. For additional details, please review the Disclosure Statements at https://astrazenecagrouptrials.pharmacm.com/ST/Submission/Disclosure.",https://astrazenecagroup-dt.pharmacm.com/DT/Home,Yes,Qualified researchers can request access to anonymized individual patient-level data from AstraZeneca group of companies sponsored clinical trials via the request portal. All request will be evaluated as per the AZ disclosure commitment: https://astrazenecagrouptrials.pharmacm.com/ST/Submission/Disclosure.,2021-12-04T22:28:49Z,2021-12-04T22:28:49Z,110
NCT04356937,NA,2020-04-19,2021-06-23,NA,2021-07-23,2020-04-19,2020-04-22,Actual,2021-07-23,2021-07-27,Actual,NA,NA,NA,2021-07-23,2021-07-27,Actual,"April 20, 2020",Actual,2020-04-20,July 2021,2021-07-31,"August 27, 2020",Actual,2020-08-27,"July 13, 2020",Actual,2020-07-13,NA,Interventional,NA,All randomized patients,Efficacy of Tocilizumab on Patients With COVID-19,Tocilizumab to Prevent the Progression of Hypoxemic Respiratory Failure in Hospitalized Non-Critically Ill Patients With COVID-19,Completed,NA,Phase 3,243,Actual,Massachusetts General Hospital,NA,2,NA,NA,FALSE,NA,NA,NA,TRUE,TRUE,FALSE,NA,NA,FALSE,NA,NA,NA,NA,NA,No,Request for IPD can be submitted to PI for review,2021-12-04T22:28:43Z,2021-12-04T22:28:43Z,164
NCT04362137,NA,2020-04-22,2021-04-15,NA,2021-10-07,2020-04-22,2020-04-24,Actual,2021-05-28,2021-06-02,Actual,NA,NA,NA,2021-10-07,2021-10-11,Actual,"May 2, 2020",Actual,2020-05-02,October 2021,2021-10-31,"October 17, 2020",Actual,2020-10-17,"October 17, 2020",Actual,2020-10-17,NA,Interventional,RUXCOVID,NA,Study to Assess the Efficacy and Safety of Ruxolitinib in Patients With COVID-19 Associated Cytokine Storm,"Phase 3 Randomized, Double-blind, Placebo-controlled Multi-center Study to Assess the Efficacy and Safety of Ruxolitinib in Patients With COVID-19 Associated Cytokine Storm (RUXCOVID)",Completed,NA,Phase 3,432,Actual,Novartis,NA,2,NA,NA,FALSE,NA,NA,NA,TRUE,TRUE,FALSE,NA,NA,NA,NA,NA,NA,NA,NA,Yes,"Novartis is committed to sharing with qualified external researchers, access to patient-level data and supporting clinical documents from eligible studies. These requests are reviewed and approved by an independent review panel on the basis of scientific merit. All data provided is anonymized to respect the privacy of patients who have participated in the trial in line with applicable laws and regulations.

This trial data availability is according to the criteria and process described on www.clinicalstudydatarequest.com",2021-12-04T22:28:40Z,2021-12-04T22:28:40Z,88
NCT04354870,NA,2020-04-16,2021-09-29,NA,2021-10-04,2020-04-16,2020-04-21,Actual,2021-10-04,2021-10-06,Actual,NA,NA,NA,2021-10-04,2021-10-06,Actual,"April 3, 2020",Actual,2020-04-03,October 2021,2021-10-31,"October 1, 2020",Actual,2020-10-01,"September 15, 2020",Actual,2020-09-15,NA,Interventional,NA,NA,COVID-19 PrEP HCW HCQ Study,Off Label Study to Evaluate the Efficacy of HCQ for Pre-exposure Prophylaxis (PrEP) to Prevent Severe Acute Respiratory Syndrome Coronavirus 2 (SARS-CoV-2) Infection Among Health Care Workers (HCWs) Who Are at High Risk of Occupational Exposure to SARS-CoV-2,Completed,NA,Phase 2,130,Actual,NYU Langone Health,NA,2,NA,NA,FALSE,NA,NA,NA,TRUE,TRUE,FALSE,NA,NA,TRUE,NA,NA,NA,NA,NA,No,Study internal to NYU at this time,2021-12-04T22:28:44Z,2021-12-04T22:28:44Z,91
NCT04345653,NA,2020-04-08,2021-04-01,NA,2021-05-10,2020-04-13,2020-04-14,Actual,2021-05-05,2021-05-10,Actual,NA,NA,NA,2021-05-10,2021-05-12,Actual,"April 14, 2020",Actual,2020-04-14,May 2021,2021-05-31,"May 10, 2021",Actual,2021-05-10,"June 5, 2020",Actual,2020-06-05,NA,Interventional,NA,High risk healthcare providers,Hydroxychloroquine as Chemoprevention for COVID-19 for High Risk Healthcare Workers,"Feasibility, Safety and Early Efficacy Trial of Hydroxychloroquine as Primary Prevention of Corona Virus Disease 2019 in High Risk Health Care Providers",Completed,NA,Phase 2,48,Actual,Hackensack Meridian Health,NA,1,NA,NA,FALSE,NA,NA,NA,TRUE,TRUE,FALSE,NA,NA,FALSE,NA,NA,NA,NA,NA,No,NA,2021-12-04T22:28:49Z,2021-12-04T22:28:49Z,238
NCT04343261,NA,2020-04-08,2020-09-01,NA,2020-09-22,2020-04-08,2020-04-13,Actual,2020-09-15,2020-09-17,Actual,NA,NA,NA,2020-09-22,2020-09-24,Actual,"April 10, 2020",Actual,2020-04-10,September 2020,2020-09-30,"August 13, 2020",Actual,2020-08-13,"July 23, 2020",Actual,2020-07-23,NA,Interventional,NA,NA,Convalescent Plasma in the Treatment of COVID 19,Convalescent Plasma in the Treatment of COVID 19,Completed,NA,Phase 2,48,Actual,Saint Francis Care,NA,1,NA,NA,FALSE,NA,NA,NA,FALSE,TRUE,FALSE,NA,NA,NA,NA,NA,NA,NA,NA,No,NA,2021-12-04T22:28:50Z,2021-12-04T22:28:50Z,468
NCT04358081,NA,2020-04-08,2021-03-08,NA,2021-10-07,2020-04-20,2020-04-22,Actual,2021-03-08,2021-03-17,Actual,NA,NA,NA,2021-10-07,2021-10-11,Actual,"May 1, 2020",Actual,2020-05-01,October 2021,2021-10-31,"July 27, 2020",Actual,2020-07-27,"July 27, 2020",Actual,2020-07-27,NA,Interventional,NA,Full Analysis Set (FAS) was comprised of all participants to whom study treatment had been assigned by randomization excluding one mis-randomized participant.,Hydroxychloroquine Monotherapy and in Combination With Azithromycin in Patients With Moderate and Severe COVID-19 Disease,"A Multi-center, Randomized, Double-blinded, Placebo-controlled Study to Evaluate the Safety and Efficacy of Hydroxychloroquine Monotherapy and in Combination With Azithromycin in Patients With Moderate and Severe COVID-19 Disease",Completed,NA,Phase 3,20,Actual,Novartis,NA,3,NA,NA,NA,NA,NA,NA,TRUE,TRUE,FALSE,NA,NA,NA,NA,NA,NA,NA,NA,Undecided,"Novartis is committed to sharing access to patient-level data and supporting clinical documents from eligible studies with qualified external researchers. Requests are reviewed and approved by an independent review panel on the basis of scientific merit. All data provided is anonymized to protect the privacy of patients who have participated in the trial in line with applicable laws and regulations.

This trial data availability is according to the criteria and process described on www.clinicalstudydatarequest.com",2021-12-04T22:28:42Z,2021-12-04T22:28:42Z,88
NCT04343092,NA,2020-04-05,2020-06-11,NA,2020-11-02,2020-04-08,2020-04-13,Actual,2020-11-02,2020-11-04,Actual,NA,NA,NA,2020-11-02,2020-11-04,Actual,"April 18, 2020",Actual,2020-04-18,November 2020,2020-11-30,"June 1, 2020",Actual,2020-06-01,"May 31, 2020",Actual,2020-05-31,NA,Interventional,NA,NA,Effectiveness of Ivermectin as add-on Therapy in COVID-19 Management,Effectiveness of Ivermectin as add-on Therapy in COVID-19 Management (An Externally Controlled Pilot Trial),Completed,NA,Phase 1,16,Actual,University of Baghdad,NA,1,NA,NA,FALSE,NA,NA,NA,TRUE,FALSE,FALSE,NA,NA,NA,NA,NA,NA,NA,NA,No,NA,2021-12-04T22:28:51Z,2021-12-04T22:28:51Z,427
NCT04342663,NA,2020-04-08,2021-07-01,NA,2021-07-07,2020-04-08,2020-04-13,Actual,2021-07-07,2021-07-09,Actual,NA,NA,NA,2021-07-07,2021-07-09,Actual,"April 10, 2020",Actual,2020-04-10,July 2021,2021-07-31,"December 12, 2020",Actual,2020-12-12,"August 20, 2020",Actual,2020-08-20,NA,Interventional,STOP COVID,NA,"A Double-blind, Placebo-controlled Clinical Trial of Fluvoxamine for Symptomatic Individuals With COVID-19 Infection","A Double-blind, Placebo-controlled Clinical Trial of Fluvoxamine for Symptomatic Individuals With COVID-19 Infection",Completed,NA,Phase 2,152,Actual,Washington University School of Medicine,NA,2,NA,NA,FALSE,NA,NA,NA,FALSE,TRUE,FALSE,NA,NA,FALSE,NA,NA,NA,NA,NA,NA,NA,2021-12-04T22:28:51Z,2021-12-04T22:28:51Z,180
NCT04342897,NA,2020-04-10,2021-08-04,NA,2021-08-04,2020-04-10,2020-04-13,Actual,2021-08-04,2021-08-12,Actual,NA,NA,NA,2021-08-04,2021-08-12,Actual,"April 20, 2020",Actual,2020-04-20,August 2021,2021-08-31,"October 12, 2020",Actual,2020-10-12,"October 12, 2020",Actual,2020-10-12,NA,Interventional,NA,All randomized participants who received at least 1 dose of study drug.,A Study of LY3127804 in Participants With COVID-19,"A Randomized, Double-blind, Placebo-controlled, Clinical Trial of LY3127804 in Patients Who Are Hospitalized With Pneumonia and Presumed or Confirmed COVID-19",Terminated,NA,Phase 2,95,Actual,Eli Lilly and Company,NA,2,NA,Trial terminated for futility.,FALSE,NA,NA,NA,TRUE,TRUE,FALSE,NA,NA,NA,NA,NA,"Data are available 6 months after the primary publication and approval of the indication studied in the US and European Union (EU), whichever is later. Data will be indefinitely available for requesting","Data are available 6 months after the primary publication and approval of the indication studied in the US and EU, whichever is later. Data will be indefinitely available for requesting",http://vivli.org/,Yes,Anonymized individual patient level data will be provided in a secure access environment upon approval of a research proposal and a signed data sharing agreement,2021-12-04T22:28:51Z,2021-12-04T22:28:51Z,152
NCT04340557,NA,2020-04-06,2021-05-20,NA,2021-05-24,2020-04-08,2020-04-09,Actual,2021-05-24,2021-05-26,Actual,NA,NA,NA,2021-05-24,2021-05-26,Actual,"March 27, 2020",Actual,2020-03-27,May 2021,2021-05-31,"June 13, 2020",Actual,2020-06-13,"June 13, 2020",Actual,2020-06-13,NA,Interventional,NA,NA,Do Angiotensin Receptor Blockers Mitigate Progression to Acute Respiratory Distress Syndrome With SARS-CoV-2 Infection,Randomized Open Label Study of Standard of Care Plus an Angiotensin II Receptor Blocker Compared to Standard of Care Alone to Minimize the Progression to Respiratory Failure in SARS-CoV-2 Infection,Completed,NA,Phase 4,31,Actual,Sharp HealthCare,NA,2,NA,NA,FALSE,NA,NA,NA,TRUE,TRUE,FALSE,NA,NA,FALSE,NA,NA,NA,NA,NA,No,NA,2021-12-04T22:28:52Z,2021-12-04T22:28:52Z,224
NCT04333225,NA,2020-04-01,2021-08-02,NA,2021-08-18,2020-04-02,2020-04-03,Actual,2021-08-18,2021-08-20,Actual,NA,NA,NA,2021-08-18,2021-08-20,Actual,"April 3, 2020",Actual,2020-04-03,May 2020,2020-05-31,"June 30, 2020",Actual,2020-06-30,"June 30, 2020",Actual,2020-06-30,NA,Interventional,NA,NA,Hydroxychloroquine in the Prevention of COVID-19 Infection in Healthcare Workers,A Prospective Clinical Study of Hydroxychloroquine in the Prevention of SARS- CoV-2 (COVID-19) Infection in Healthcare Workers After High-risk Exposures,Completed,NA,Phase 2,221,Actual,Baylor Research Institute,NA,2,NA,NA,FALSE,NA,NA,NA,TRUE,TRUE,FALSE,NA,NA,FALSE,NA,NA,NA,NA,NA,No,NA,2021-12-04T22:28:58Z,2021-12-04T22:28:58Z,138
NCT04332991,NA,2020-03-31,2021-02-09,NA,2021-03-12,2020-03-31,2020-04-03,Actual,2021-03-12,2021-03-17,Actual,NA,NA,NA,2021-03-12,2021-03-17,Actual,"April 2, 2020",Actual,2020-04-02,March 2021,2021-03-31,"July 23, 2020",Actual,2020-07-23,"June 19, 2020",Actual,2020-06-19,NA,Interventional,ORCHID,NA,Outcomes Related to COVID-19 Treated With Hydroxychloroquine Among In-patients With Symptomatic Disease,Outcomes Related to COVID-19 Treated With Hydroxychloroquine Among In-patients With Symptomatic Disease,Completed,NA,Phase 3,479,Actual,Massachusetts General Hospital,NA,2,NA,NA,FALSE,NA,NA,NA,TRUE,TRUE,FALSE,NA,NA,NA,NA,NA,NA,NA,NA,NA,NA,2021-12-04T22:28:58Z,2021-12-04T22:28:58Z,297
NCT04338009,NA,2020-04-01,2021-01-28,NA,2021-04-07,2020-04-07,2020-04-08,Actual,2021-04-07,2021-04-09,Actual,NA,NA,NA,2021-04-07,2021-04-09,Actual,"March 31, 2020",Actual,2020-03-31,April 2021,2021-04-30,"August 20, 2020",Actual,2020-08-20,"August 20, 2020",Actual,2020-08-20,NA,Interventional,REPLACECOVID,NA,Elimination or Prolongation of ACE Inhibitors and ARB in Coronavirus Disease 2019,The Randomized Elimination or Prolongation of Angiotensin Converting Enzyme Inhibitors and Angiotensin Receptor Blockers in Coronavirus Disease 2019,Completed,NA,Not Applicable,152,Actual,University of Pennsylvania,NA,2,NA,NA,FALSE,NA,NA,NA,TRUE,FALSE,FALSE,NA,NA,NA,NA,NA,NA,NA,NA,No,Not making it available,2021-12-04T22:28:54Z,2021-12-04T22:28:54Z,271
NCT04338074,NA,2020-04-06,2021-04-21,NA,2021-05-11,2020-04-06,2020-04-08,Actual,2021-05-11,2021-05-13,Actual,NA,NA,NA,2021-05-11,2021-05-13,Actual,"June 1, 2020",Actual,2020-06-01,May 2021,2021-05-31,"April 21, 2021",Actual,2021-04-21,"April 21, 2021",Actual,2021-04-21,NA,Interventional,TCOutpatient,NA,TXA and Corona Virus 2019 (COVID19) in Outpatients,Exploratory Studies of the Effect of Tranexamic Acid Treatment on the Progression of COVID19 in Outpatients,Terminated,NA,Phase 2,5,Actual,University of Alabama at Birmingham,NA,2,NA,Lack of recruitment,FALSE,NA,NA,NA,TRUE,TRUE,FALSE,NA,NA,NA,NA,NA,NA,NA,NA,No,NA,2021-12-04T22:28:54Z,2021-12-04T22:28:54Z,237
NCT04329923,NA,2020-03-30,2020-11-13,NA,2020-12-08,2020-03-30,2020-04-01,Actual,2020-12-08,2020-12-10,Actual,NA,NA,NA,2020-12-08,2020-12-10,Actual,"April 9, 2020",Actual,2020-04-09,December 2020,2020-12-31,"November 13, 2020",Actual,2020-11-13,"November 11, 2020",Actual,2020-11-11,NA,Interventional,PATCH,All randomized patients,The PATCH Trial (Prevention And Treatment of COVID-19 With Hydroxychloroquine),The PATCH Trial (Prevention And Treatment of COVID-19 With Hydroxychloroquine),Terminated,NA,Phase 2,173,Actual,University of Pennsylvania,NA,6,NA,Cohort 1: slow accrual Cohort 2: Other studies showed no benefit Cohort 3: Study met pre-specificied futility analysis at planned second interim analysis,FALSE,NA,NA,NA,FALSE,TRUE,FALSE,NA,NA,FALSE,NA,NA,One year after study completion,Open access,NA,Yes,We will publish our results in a peer-reviewed journal and make available de-identified data for additional analysis,2021-12-04T22:29:04Z,2021-12-04T22:29:04Z,391
